_id,ltable_id,rtable_id,ltable_name,ltable_description,ltable_price,rtable_name,rtable_description,rtable_price
316,498,7,Canon DVD Camcorder - DC320,Canon DVD Camcorder - DC320/ Image Stabilization/ Widescreen HR Recording/ 2.7' LCD Screen/ Smooth Zoom Control/ Built-In Lens Cover/ 9 Digital Effects/9 Fades/ 21 Selectable Display Languages/ 37x Optical/2000x Digital Zoom/ Silver Finish,_,Canon KP 36IP Print Cartridge / Paper Kit - 7737A001,36 Page 4' x 6',$9.99
554,140,15,Directed 50ft Extension Cable - 14230,"Directed 50ft Extension Cable - 14230/ Built-In Signal Amplifier/ SMB Connector/ Indoor/Outdoor Use For Home, RVs And Boat/ Black Finish",_,Belkin Monitor Cable - F3H982-25,1 x HD-15 - 1 x HD-15 - 25ft - Black,$15.98
953,822,19,Sony Black DVD Recorder And VHS Combo Player - RDRVX560,"Sony Black DVD Recorder And VHS Combo Player - RDRVX560/ Multiformat DVD Compatible/ HDMI Output With 1080p,1080i,720p Upscaling/ USB One Touch Dubbing/ 4 Video Head Stereo VHS With 19 Micron Heads/ Virtual Surround Sound For DVD With Stereo TV Speakers/ Black Finish",$219.00,Sony VAIO Notebook and AC Adapter Case - VGPAMC2,VAIO NEOPRENE NOTEBOOK & AC ADAPTER CASE UP TO 17 IN LCD,_
1782,49,23,Sanus WMS3S Silver Weather Resistant Small Speaker Wall Mount - WMS3S,Sanus WMS3S Silver Small Speaker Wall Mount - WMS3S/ Holds Up To An 8 Pound Speaker/ Multiple Pivot Points/ Weather Resistant For Indoor/Outdoor Use/ Silver Finish/ Priced Per Pair,$29.99,Logitech Z-2300 Multimedia Speaker System - 970118-0403,2.1-channel,_
1853,707,23,Panasonic Black DVD Home Theater Sound System - SCPT660,Panasonic Black DVD Home Theater Sound System - SCPT660/ Kelton Subwoofer/ Bamboo Diaphragm Center Speakers/ 1080p Up-Conversion/ Integrated Universal Dock And On-Screen Display For iPod/ iPod Video Playback/ Whisper-Mode Surround/ Built-In Dolby Digital And DTS Decoder/ High Speed 5-DVD/CD Changer/ Black Finish,$289.00,Logitech Z-2300 Multimedia Speaker System - 970118-0403,2.1-channel,_
1964,429,24,Sony HD-Handycam 3 Meters (10 Feet) HDMI Mini Cable - VMC30MHD,Sony HD-Handycam 3 Meters (10 Feet) HDMI Mini Cable - VMC30MHD/ Gold Plating Plug/ HDMI-Compliant High Speed Category 2 Cable/ Support Full HD 1080p/ Digital Audio Transfer/ 3 Meters(10 Feet)/ Black Finish,$69.00,Sony High Definition Mini DV Cassette - DSL-190-B,Sony DVM-63 HD High-Definition miniDV Videocassette,_
2130,26,26,Netgear RangeMax Wireless Access Point - White Finish - WPN802NA,"Netgear RangeMax Wireless Access Point - WPN802NA/ Improves Performance Of Existing Legacy 802.11b And 802.11g Wireless Devices Up To 50 Percent/ Wired Equivalent Privacy (WEP) 64-Bit,128-Bit Encryption/ Wi-Fi Protected Access (WPA, Pre-Shared Key)",$130.00,Netgear RangeMax WPN802 Wireless Access Point - WPN802NA,108Mbps,_
2353,723,29,Sony Black 9 Megapixel Cyber-Shot Digital Camera - DSCH50B,Sony Black 9 Megapixel Cyber-Shot Digital Camera - DSCH50B/ 9 Megapixels/ 3.0' Tilt-Up Clear Photo LCD Plus Display/ Carl Zeiss 15X Optical Zoom Lens/ 15 MB Internal Memory/ Versatile Long Distance Flash/ Smart Zoom/ In-Camera Red-Eye Correction/ Smile Shutter Technology/ Face Detection/ In-Camera Retouching/ Super SteadyShot Optical Image Stabilization/ Double Anti-Blur Solution/ HDTV Compatibility/ NightShot Infrared System/ Black Finish,_,SONY 7-11719-70670-0 PS2 8 MB Memory Card 2-pk - 97067,_,_
2429,1068,29,Sony 52' BRAVIA XBR Series Black LCD Flat Panel HDTV - KDL52XBR6,Sony 52' BRAVIA XBR Series Black LCD Flat Panel HDTV - KDL52XBR6/ 1920 x 1080 Full HD 1080p Resolution/ Digital Media Extender (DMex)/ BRAVIA Engine II Technology/ Advanced Contrast Enhancer (ACE)/ 24p True Cinema/ 120Hz Refresh Rate With Dejudder Processing/ Bottom-Mounted Speaker/ Black Finish,_,SONY 7-11719-70670-0 PS2 8 MB Memory Card 2-pk - 97067,_,_
3088,585,35,Panasonic Black 8.5' Portable DVD Player - DVDLS83,Panasonic Black 8.5' Portable DVD Player - DVDLS83/ 8.5' Free Style Wide Screen LCD Display/ 6 Hour Battery/ Multi Format Playback/ Dual Headphone Jacks/ DivX Playback/ Car DC Adapter Included/ Black Finish,_,Panasonic KX-TS108W Corded Phone,1 x Phone Line(s) - White,_
3211,629,36,Panasonic DECT 6.0 Silver Expandable Digital Cordless Phone System - KXTG9332S,Panasonic DECT 6.0 Silver Expandable Digital Cordless Phone System - KXTG9332S/ 2 Handsets System/ Digital Answering Machine/ Ringer ID/ Talking Caller ID/ Voicemail/ Hold/ Mute/ Clock/ Alarm/ LED Lighting/ Night Mode/ Speakerphone/ Intercom/ 11 Days Standby/ 5 Hours Talk Time/ Silver Finish,_,Panasonic KX-TS208W Corded Phone,2 x Phone Line(s) - Headset - White,_
3462,880,38,Sony 46' BRAVIA Z Series Black LCD Flat Panel HDTV - KDL46Z4100B,Sony 46' BRAVIA Z Series Black LCD Flat Panel HDTV - KDL46Z4100B/ 1920 x 1080 Full HD 1080p Resolution/ Digital Media Extender (DMex)/ BRAVIA Engine Technology/ Advanced Contrast Enhancer (ACE)/ Enhanced (XMB) User Interface With Rich 3D Graphics/ 24p True Cinema/ Black Finish,_,Sony h.ear Stereo Earphones - MDRJ10/BLUE,_,$12.38
3473,916,38,Sony Silver Cyber-Shot Digital Camera - DSCW170,Sony Silver Cyber-Shot Digital Camera - DSCW170/ 10.1 Megapixels/ 2.7' LCD Display/ 15 MB Internal Memory/ Carl Zeiss 5X Optical Zoom Lens/ BIONZ Real Imaging Processor Technology/ 16:9 High-Resolution Mode/ 9-Point Auto Focus/ Automatic Macro Shooting/ High Sensitivity Mode/ Burst Mode/ Face Detection/ Intelligent Scene Recognition Mode/ In-Camera Retouching/ Super SteadyShot Optical Image Stabilization With Anti-Blur Solution/ Music Slideshow/ HDTV Compatibility/ Beginner-Friendly Function Guide/ Silver Finish,_,Sony h.ear Stereo Earphones - MDRJ10/BLUE,_,$12.38
3857,123,42,Sony VAIO VGP-PRSZ1 SZ Series Docking Station - VGPPRSZ1,"Sony VAIO VGP-PRSZ1 SZ Series Docking Station - VGPPRSZ1/ Compatible With SZ Series Notebooks/ Expand Connectivity To Your Notebook/ 3 USB 2.0, Gigabit Ethernet, VGA, DVI-D And DC In/ Black Finish",$199.00,Sanus Euro Foundation Series III Speaker Stand - EFSATSIII,Steel - Silver,_
4007,294,43,Sanus SC1A Black VisionMount Series Ceiling Mount For Small LCD Flat Panels - SC1AB,Sanus SC1A Black VisionMount Series Ceiling Mount For Small LCD Flat Panels - SC1AB/ Fits Most 13' - 26' LCD Flat Panel Televisions/ VESA Compatible TV Bracket/ SmoothLock Technology/ Built-In Wire Management System/ 50 Lbs Capacity/ Black Finish,$99.99,Peerless Adjustable TV Wall Mount - PM1327,_,_
5034,1052,48,Onkyo THX Ultra2 Certified 7.1 Channel Home Theater Black Receiver - TXNR906B,"Onkyo THX Ultra2 Certified 7.1 Channel Home Theater Black Receiver - TXNR906B/ 145W x 7/ HDMI v1.3/ All Discrete Circuitry/ Absolute Ground Plate/ Optimum Gain Volume/ Audyssey Dynamic EQ/ Non-Scaling Configuration/ Toroidal Transformer/ Dolby Digital Plus, Dolbyl TrueHD, DTS-HD Master Audio, DTS-HD High Resolution Audio Decoder/ Music Optimizer/ HDMI Deep Color Capable (36bit)/ 1080p Upscaling Via HDMI/ Analog To HDMI Upconversion/ Permanent Memory Storage/ Back-Lit Remote/ Black Finish",_,Sanus Speaker Mount - WMS3B BLACK,Plastic - 8 lb,_
5124,597,49,Panasonic Silver Lumix Wide Angle Lens Digital Camera - DMCTZ5S,Panasonic Silver Lumix Wide Angle Lens Digital Camera - DMCTZ5S/ 9.1 Megapixel/ LEICA 28mm Wide-Angle Lens With 10x Optical Zoom/ 3.0' LCD Display With Intelligent LCD Function/ Burst Mode/ Scene Mode/ Auto Angle Detection/ 27MB Built-In Memory/ SD Memory Slot/ Silver Finish,_,Sanus Wall/Ceiling Speaker Mount - WMS3S SILVER,Plastic - 8 lb,_
5217,375,50,Sony Stereo Bluetooth Speaker - SRSBTM30,"Sony Stereo Bluetooth Speaker - SRSBTM30/ Compact, Lightweight And Compatible With Bluetooth-Enabled Devices Such As MP3 Players, Mobile Phones And PCs/ 2-Way Power Supply/ 1 Analog Input",_,Sony Mini DVD-R Media - 3DMR30L1H,1.4GB - 3 Pack,$6.99
5550,638,53,Samsung 46' Series 6 LCD Black Flat Panel HDTV - LN46A650,"Samsung 46' Series 6 LCD Black Flat Panel HDTV - LN46A650/ Full 1080p High Definition Resolution/ 16:9 Widescreen Aspect Ratio/ 50,000:1 Dynamic Contrast Ratio/ 4ms Response Time And Auto Motion Plus 120Hz Technology/ SRS TruSurround XT Audio/ Built-In Digital Tuner (ATSC/Clear QAM)/ Picture-In-Picture/ Auto Volume Leveler/ 4 HDMI Slots/ Swivel Stand/ Piano Black With Hint Amber Finish",_,Sanus Flat Panel TV Wall Mount - VMPL50-B,Steel - 130 lb,_
5857,373,55,Sony Black Active Speaker System - SRSA212BK,Sony Black Active Speaker System - SRSA212BK/ Designed For Your Portable Audio Or PC/ Built-In Mega Bass/ On/Off Switch With Volume Control/ Magnetically Shielded/ Black Finish,$29.00,Sony STR-DE197 - AV Receiver - 100 Watts per Channel,_,$122.43
6424,871,59,Denon Blu-ray Disc DVD/CD Player - DVD3800BDCI,Denon Blu-ray Disc DVD/CD Player - DVD3800BDCI/ 10-Bit Realta HQV Video Processor/ 1080p/24fps Output And Multi-Cadence Detection/ HDMI 1.3a Output With 36-Bit Deep Color Support/ Dual 32-Bit Floating Point DSP/ Multi-Layered Construction With Dual-Layered Top Shields And Triple-Layered Bottom/ Suppress Vibration Hybrid (S.V.H.) Loader/ Black Finish,"$1,999.00",Sony CDP-CX355 300 Disc MegaStorage CD Changer,_,$169.13
6505,202,60,Garmin StreetPilot C330 Dash Mount - Black Finish - 0101061300,Garmin StreetPilot C330 Dash Mount - 0101061300/ Non-Skid Mount Design/ Fully Portable/ Includes 12/24 Volt Cigarette Lighter Adapter/ Black Finish,$57.00,Sanus Flat Panel TV Wall Mount - VM1B,Aluminum - 50 lb,$69.99
6801,195,63,Sony 400 Disc MegaStorage CD Changer - CDPCX455,Sony 400 Disc MegaStorage CD Changer - CDPCX455/ MP3 Playback Capability/ CD-R/CD-RW Playback/ Twin Jog Dial For Easy Disc Access/ MegaChanger Control/ Optical Digital Output/ Keyboard Input/ Remote Commander? Remote Control,_,Sony CDX-565MXRF 10-Disc CD/MP3 Changer,_,$134.12
7343,333,67,Olympus PS-BLS1 Lithium Ion Rechargeable Battery - LIIONPSBLS1,Olympus PS-BLS1 Lithium Ion Rechargeable Battery - LIIONPSBLS1/ Double Your Shooting Time With A Spare Battery For The Evolt E-410,_,Canon CB-2LV Battery Charger - 9764A001,for NB-4L,_
7477,600,68,Nikon D60 Digital Camera With 18-55MM Lens - D60OUTFIT,Nikon D60 Digital Camera With 18-55MM Lens - D60OUTFIT/ 10.2 Megapixel/ AF-S DX NIKKOR 18-55MM F/3.5-5.6G VR Image Stabilization Lens/ In-Camera Image Editing And Enhanced Retouch Menu/ Built-In Speedlight/ Image Optimization/ 2.5' LCD Screen/ Product Number 25438/ Black Finish,_,Canon EF-S 17-85MM f/4-5.6 IS USM Standard Zoom Lens,Canon 9517A002 EF-S 17-85mm f4-5.6 IS USM Standard Zoom Lens with Optical Image Stabilizer,$515.00
7652,664,1077,Sony 2GB Memory Stick PRO Duo Mark 2 Media Card - MSMT2G,Sony 2GB Memory Stick PRO Duo Mark 2 Media Card - MSMT2G/ 160 Mbps Transfer Speed/ 1.85GB Actual Capacity,$29.99,Sony Fontopia Earbuds - MDREX81LPB,Sony MDR-EX81LP/B Stereo Earphones - Black,$34.88
7955,641,72,Samsung 52' Series 6 LCD Black Flat Panel HDTV - LN52A650,"Samsung 52' Series 6 LCD Black Flat Panel HDTV - LN52A650/ Full 1080p High Definition Resolution/ 16:9 Widescreen Aspect Ratio/ 50,000:1 Dynamic Contrast Ratio/ 4ms Response Time And Auto Motion Plus 120Hz Technology/ SRS TruSurround XT Audio/ Built-In Digital Tuner (ATSC/Clear QAM)/ Picture-In-Picture/ Auto Volume Leveler/ 4 HDMI Slots/ Swivel Stand/ Piano Black With Hint Amber Finish",_,Sanus Flat Panel TV Wall Mount - VM400S,"Steel, Aluminum - 80 lb",_
8041,75,73,Sanus 15' - 40' Flat Panel TV Black Wall Mount - VM400B,Sanus 15' - 40' Flat Panel TV Black Wall Mount - VM400B/ Virtual Axis Tilt Adjustment System/ Hinged Arm Extend From 3.5' To 20'/ Durable Powder Coated Black Finish,_,Sanus Under Cabinet LCD TV Mount - VMUC1S,15 lb,_
9118,608,79,Sony Remote Control Tripod - VCT60AV,Sony Remote Control Tripod - VCT60AV/ A/V Remote Connector/ 4 Stage Leg Extension/ Extends From 18.9' To 57.6' In Height/ Guide Frame Feature/ Available Vertical Position/ Supplied Carrying Case/ Black Finish,$99.00,Sony LCS Soft Carrying Case - LCSCST,Sony LCS-CST Soft Carrying Case for Ultra-Compact Digital Cameras,$9.95
9524,988,83,Belkin Leather Folio For 2G iPod Touch - F8Z373,"Belkin Leather Folio For 2G iPod Touch - F8Z373/ Soft, Durable Leather/ Soft-Microfiber Lining/ Velcro Fastening/ Clear Screen Protector Allows Easy Navigation/ Access To Ports And Dock Connector/ Black Finish (iPod Not Included)",$29.00,"Canon Ink Cartridge For PIXMA iP1600, iP6210D and iP6220D Printers - 0617B002",Color,$19.11
9687,822,84,Sony Black DVD Recorder And VHS Combo Player - RDRVX560,"Sony Black DVD Recorder And VHS Combo Player - RDRVX560/ Multiformat DVD Compatible/ HDMI Output With 1080p,1080i,720p Upscaling/ USB One Touch Dubbing/ 4 Video Head Stereo VHS With 19 Micron Heads/ Virtual Surround Sound For DVD With Stereo TV Speakers/ Black Finish",$219.00,"Canon Ink Cartridge For PIXMA iP4200, iP5200, iP5200R and iP6600D Printers - 0620B002",Black,$13.99
10110,576,87,Sony Black Handycam Camcorder Soft Carrying Case - LCSX20,Sony Black Handycam Camcorder Soft Carrying Case - LCSX20/ Compatible To Hard Drive And DVD Camcorders/ Stain Resistant Nylon/ Organizer For Accessories/ Shoulder Held Case,_,Canon Black Ink Cartridge - 0615B002,Black,_
10247,842,87,Skullcandy CHOPS Headphones In Black Chrome - HH26SKC01,"Skullcandy CHOPS Headphones In Black Chrome - HH26SKC01/ 15mm Speaker/ Hanger Anchor Design/ Frequency Range Of 18 ? 20,000 Hz/ 1.2m Cord Length/ 3.5mm Gold Plated Plug/ Black Chrome Finish",$24.95,Canon Black Ink Cartridge - 0615B002,Black,_
10481,335,88,Jabra Black Bluetooth Headset - BT5010,Jabra Black Bluetooth Headset - BT5010/ Up To 10 Hours Of Talk Time And 300 Hours Of Stand-By/ Wind-Noise Reduction Technology/ Vibrating And Visual Alerts/ Colored LED Indicator/ Up To 33-Foot Wireless Range/ Black Finish,$79.00,Canon PGI-5BK Black Ink Cartridge - 0628B002,Canon PGI-5 Pigment Black Ink Cartridge for Canon ContrastPLUS Photo Printers,$14.99
10628,660,88,Samsung 50' Black Flat Panel Series 5 Plasma HDTV - PN50A550,"Samsung 50' Black Flat Panel Series 5 Plasma HDTV - PN50A550/ 1920 x 1080 Full HD Resolution/ 1,000,000:1 Dynamic Contrast Ratio/ Ultra FilterBright Anti-Glare And Anti Burn-In Technology/ Built-In HDTV Tuner (ATSC/NTSC) With Clear QAM/ SRS TruSurround XT/ 3D HD Ready/ Swivel Stand/ Black Finish",_,Canon PGI-5BK Black Ink Cartridge - 0628B002,Canon PGI-5 Pigment Black Ink Cartridge for Canon ContrastPLUS Photo Printers,$14.99
11083,91,92,Netgear ProSafe 16 Port 10/100 Desktop Switch - Purple Finish - FS116P,Netgear ProSafe 16 Port 10/100 Desktop Switch - FS116P/ 16 Auto Speed-Sensing 10/100 RJ-45 Ports/ 96 KB Embedded Memory Per Unit,$299.00,Netgear ProSafe JGS524F 24-Port Gigabit Ethernet Switch - JGS524FNA,Netgear ProSafe JGS544F - 24 Port Gigabit Rackmount Switch with 2 Gigabit Slots,_
12302,806,99,Speck SeeThru Pink Hard Shell Case For 15' MacBook - MB15PNKSEEV2,Speck SeeThru Pink Hard Shell Case For 15' MacBook - MB15PNKSEEV2/ Translucent Hard Plastic Shell Gives Great Protection/ Full Access To All Controls/ Rubber Feet For Added Support/ Pink Finish,_,Canon CL-52 Photo Ink Cartridge For PIXMA iP6210D and PIXMA iP6220D Printers - 0619B002,Color,$18.16
12351,1041,99,Canon Printer Ink Cartridge 4 Colors Pack - 2946B004,"Canon Printer Ink Cartridge 4 Colors Pack - 2946B004/ FINE Technology For Exceptional Sharpness And Detail/ Compatible With PIXMA iP3600, PIXMA iP4600, PIXMA MP620 And PIXMA MP980/ Includes 4 Ink Tanks (Black, Cyan, Magenta, Yellow)",$47.00,Canon CL-52 Photo Ink Cartridge For PIXMA iP6210D and PIXMA iP6220D Printers - 0619B002,Color,$18.16
13114,101,106,Delonghi Twenty Four Seven Coffee Maker In Black - DC50B,"Delonghi Twenty Four Seven Coffee Maker - DC50B/ 4-Cup Capacity/ Easy-Access, Washable Filter Basket/ Black Finish",$22.00,Panasonic NN-H965BF Microwave Oven - Counter Top - 2.2ft - 1250W - Black,_,_
13997,821,111,Sony Black 5.1 Channel Home Theater System - HTDDWG700,Sony Black 5.1 Channel Home Theater System - HTDDWG700/ 5.1 Channel/ 900 Watts Power/ Portable Audio Enhancer With Front Audio Input/ iPod Cradle/ Digital Cinema Auto Calibration/ BRAVIA Sync/ Digital Media Port/ Black Finish,$199.00,Sony Memory Stick Duo Replacement Adapter - MSACM2,Memory Stick Adapter - Memory Stick Duo,$19.48
14061,1067,111,Sony 46' BRAVIA XBR Series Black LCD Flat Panel HDTV - KDL46XBR6,Sony 46' BRAVIA XBR Series Black LCD Flat Panel HDTV - KDL46XBR6/ 1920 x 1080 Full HD 1080p Resolution/ Digital Media Extender (DMex)/ BRAVIA Engine II Technology/ Advanced Contrast Enhancer (ACE)/ 24p True Cinema/ 120Hz Refresh Rate With Dejudder Processing/ Bottom-Mounted Speaker/ Black Finish,_,Sony Memory Stick Duo Replacement Adapter - MSACM2,Memory Stick Adapter - Memory Stick Duo,$19.48
14135,510,113,Transcend 16GB SDHC Card And Compact Card Reader - TS16GSDHC6S5W,"Transcend 16GB SDHC Card And Compact Card Reader - TS16GSDHC6S5W/ SDHC Card Is Class 6 Compliant And Compatible With All SDHC-Labeled Host Devices/ Card Reader Is Fully Compatible With Hi Speed USB 2.0, Up To 480Mb/s And Supports SDHC Memory Cards",_,Linksys Wireless-G WUSB54GC Compact USB Adapter,_,_
14161,318,114,Weber Genesis S-310 Natural Gas Stainless Steel Outdoor Grill - 3870001,"Weber Genesis S-310 Natural Gas Stainless Steel Outdoor Grill - 3870001/ 3 Stainless Steel Burners/ 42,000 BTU-Per-Hour Input/ Electronic Crossover Ignition System/ Center Mounted Thermometer/ Cast Aluminum End Caps/ 2 Heavy Duty Front Locking Casters/ Stainless Steel Finish/ Assembly Required",$919.00,Sirius Outdoor Home Antenna - 14240,42 dBi - SMB,_
14809,114,119,Linksys Compact Wireless-G USB Adapter - WUSB54GC,Linksys Compact Wireless-G USB Adapter - WUSB54GC/ Connects Your Desktop Or Notebook To A Wireless Network At Up To 54Mbps When Used With A USB 2.0 Port/ Compatible With Wireless-B Networks (At 11Mbps)/ Protected By WPA and Up To 128-Bit Data Encryption,$39.00,Sony Memory Stick USB Card Reader/Writer - MSACUS40,"Memory Stick, Memory Stick Duo",_
14966,899,119,Sony Picture Station Digital Photo Printer - DPPFP95,"Sony Picture Station Digital Photo Printer - DPPFP95/ HDMI Output/ Lab-Quality Prints In 45 Seconds/ One-Button Auto Touch-Up/ Compatible With Memory Stick, SD, Compact Flash, And xD Card/ White Finish",_,Sony Memory Stick USB Card Reader/Writer - MSACUS40,"Memory Stick, Memory Stick Duo",_
15453,474,121,Motorola MotoRokr Portable Bluetooth Car Kit Speaker Phone - T505,Motorola MotoRokr Portable Bluetooth Car Kit Speaker Phone - T505/ 2.0 Bluetooth Wireless Technology/ Noise Cancellation Technology/ Loud Sound High Speaker Output/ Audio CallerID/ StationFinder/ Convenient Multi-Function Button/ Long Battery Life/ Mini-USB Connector/ Black Finish,$129.00,Sanus Center Channel Speaker Mount - VMCC1B,Steel,_
15677,870,122,Sony Black Cyber-Shot Digital Camera - DSCW150B,Sony DSCW150 Black Cyber-Shot Digital Camera - DSCW150B/ 8.1 Megapixels/ 2.7' LCD Display/ 15 MB Internal Memory/ Carl Zeiss 5X Optical Zoom Lens/ 16:9 High-Resolution Mode/ 9-Point Auto Focus/ Automatic Macro Shooting/ High Sensitivity Mode/ Burst Mode/ Face Detection/ Intelligent Scene Recognition Mode/ In-Camera Retouching/ Super SteadyShot Optical Image Stabilization With Anti-Blur Solution/ Music Slideshow/ HDTV Compatibility/ Beginner-Friendly Function Guide/ Black Finish,_,Sony VAIO SZ Series Docking Station - VGPPRSZ1,"USB, Network, VGA, DVI-D, DC-in",_
15892,939,123,Sony BRAVIA Theater Black Micro System - DAVIS50B,Sony BRAVIA Theater Black Micro System - DAVIS50B/ 5.1-Channel Surround Sound/ Golf Ball-Sized Speakers/ Compact Design/ S-AIR Digital Wireless Capability/ HDMI Connectivity/ BRAVIA Sync/ Digital Cinema Sound(DCS) Technology/ S-Master Digital Amplifier/ Portable Audio Enhancer/ Black Finish,_,Sony Print Paper - SVMF40P,SVM-F40P 4'x6' Photo paper - 40-Count,$17.99
16057,339,125,D-Link Wireless N USB Adapter - DWA130,"D-Link Wireless N USB Adapter - DWA130/ Complies With Draft 802.11n Standards And Is Backward Compatible With 802.11b/g/ Up To 300 Mbps Data Transfer Rates, Delivers Up To 12x The Speed And 4x The Range Of Wireless-G/ LED Lights Include Link And Activity/ WEP (Wired Equivalent Privacy), WPA And WPA2 (Wi-Fi Protected Access)/ USB 2.0",_,Tivo AG0100 Wireless G USB Network Adapter,_,_
16094,137,126,Panasonic 2 Line 5.8 GHz FHSS GigaRange Expandable Digital Cordless Answering System - Black Finish - KXTG6700B,Panasonic 2 Line 5.8 GHz FHSS GigaRange Expandable Digital Cordless Answering System - KXTG6700B/ Expandable Up To 8 Handsets Total/ 4-Line Backlit LCD On Handset/ Voice Enhancer Technology/ Handset Speakerphone/ Clarity Booster/ Room Monitor/ 60 Minutes Of Total Record Time/ Black Finish,_,TiVo TCD649080 - Series2 Digital Video Recorder - Up to 80 Hours Capacity,_,_
16459,510,128,Transcend 16GB SDHC Card And Compact Card Reader - TS16GSDHC6S5W,"Transcend 16GB SDHC Card And Compact Card Reader - TS16GSDHC6S5W/ SDHC Card Is Class 6 Compliant And Compatible With All SDHC-Labeled Host Devices/ Card Reader Is Fully Compatible With Hi Speed USB 2.0, Up To 480Mb/s And Supports SDHC Memory Cards",_,SONY COMPACT TRIPOD 14'/39' *NIC* - VCTR100,_,_
17197,538,130,Toshiba Black 1080p Upconversion DVD Recorder/VCR Combinaton - DVR610,Toshiba Black 1080p Upconversion DVD Recorder/VCR Combinaton - DVR610/ Multi-Format Recording And Playback/ Video Upconversion Up To 1080p Resolution/ One Touch Recording/ Camcorder Controls/ Auto Finalize With Undo/ Bi-Directional Dubbing/ Black Finish,_,"Lowepro SlingShot 200 AW Camera Backpack - Backpack - MicroFiber, Ripstop Nylon - Black, Gray (Black)",_,_
18207,610,134,Panasonic Blue 8.1 Megapixel Digital Camera - DMCFS3A,Panasonic Blue 8.1 Megapixel Digital Camera - DMCFS3A/ 8.1 Megapixel/ 33mm Lens/ 3x Optical Zoom/ Intelligent Auto Mode/ 2.5' Diagonal Intelligent LCD/ MEGA Optical Image Stabilization/ Intelligent ISO Control/ Face Detection/ Hi-Speed Burst Mode/ Blue Finish,_,Panasonic KX-TGA450B Cordless Handset,Panasonic KX-TGA450B Additional Handset for PANKXTG4500B,_
18695,437,141,Sony LCS-CSQ/B Black Soft Carrying Case - LCSCSQB,"Sony LCS-CSQ/B Black Soft Carrying Case - LCSCSQB/ Compatible With T, W And N Series Cameras/ Durable Nylon Construction/ Perfect For Travel/ Black Finish",_,Sony Learning Remote Control - RMVL600,"TV, DVD Player, VCR, CD Player, Satellite Receiver, DVR - 32.81 ft - Universal Remote",$19.99
18712,572,141,Sony High Definition HDV Handycam Camcorder - HDRHC9,Sony High Definition HDV Handycam Camcorder - HDRHC9/ 10X Optical/20X Digital Zoom/ 2.7' Wide (16:9) Touch Panel Clear Photo LCD Plus Display/ Switchable HDV/DV Format Recording/ Active Interface Shoe/ Built-In Intelligent Flash/ Progressive Shutter System/ Super NightShot Infrared System/ x.v. Color Technology,_,Sony Learning Remote Control - RMVL600,"TV, DVD Player, VCR, CD Player, Satellite Receiver, DVR - 32.81 ft - Universal Remote",$19.99
18814,1067,141,Sony 46' BRAVIA XBR Series Black LCD Flat Panel HDTV - KDL46XBR6,Sony 46' BRAVIA XBR Series Black LCD Flat Panel HDTV - KDL46XBR6/ 1920 x 1080 Full HD 1080p Resolution/ Digital Media Extender (DMex)/ BRAVIA Engine II Technology/ Advanced Contrast Enhancer (ACE)/ 24p True Cinema/ 120Hz Refresh Rate With Dejudder Processing/ Bottom-Mounted Speaker/ Black Finish,_,Sony Learning Remote Control - RMVL600,"TV, DVD Player, VCR, CD Player, Satellite Receiver, DVR - 32.81 ft - Universal Remote",$19.99
19241,62,148,Canon Black Rechargeable Battery - 9612A001,"Canon Black Rechargeable Battery - 9612A001/ Lithium-Ion Technology/ Compatible With Canon Digital Rebel XT And PowerShot S Series Digital Cameras/ Also Compatible With Canon Elura Series, OPTURA Series And ZR Series Camcorders/ Black Finish",_,Canon NB-5L Lithium-Ion Digital Camera Battery - 1135B001,Canon NB-5L Lithium Ion Battery,$36.49
19713,94,152,Tripp-Lite Black 25 Foot SVGA HD15M To HD15M Computer Monitor Cable - P502025,Tripp-Lite Black 25 Foot SVGA HD15M To HD15M Computer Monitor Cable - P502025/ 25 Foot Length/ Foil-Shielding For Maximum EMI/RFI Protection/ Constructed From Mini-Coax And Paired Video/ Gold Plated Connectors And Gold Plated Copper Contacts/ HD15 Male To HD15 Male Molded Connectors/ Black Finish,_,Apple DVI to mini-DVI Video Cable Adapter - M9321GB,mini-DVI Male to 24-pin DVI-D (Digital) Male,$19.99
20051,638,155,Samsung 46' Series 6 LCD Black Flat Panel HDTV - LN46A650,"Samsung 46' Series 6 LCD Black Flat Panel HDTV - LN46A650/ Full 1080p High Definition Resolution/ 16:9 Widescreen Aspect Ratio/ 50,000:1 Dynamic Contrast Ratio/ 4ms Response Time And Auto Motion Plus 120Hz Technology/ SRS TruSurround XT Audio/ Built-In Digital Tuner (ATSC/Clear QAM)/ Picture-In-Picture/ Auto Volume Leveler/ 4 HDMI Slots/ Swivel Stand/ Piano Black With Hint Amber Finish",_,Sanus VisionMount Flat Panel TV Wall Mount - ML22-B1,Steel - 100 lb,_
21579,254,170,Sirius ST4-TK1 Starmate 4 Radio With Car Kit - ST4TK1,Sirius ST4-TK1 Starmate 4 Radio With Car Kit - ST4TK1/ SIRIUS Replay/ Universal Docking/ 30 Channel Presets/ GameAlert/ My GameZone Lists/ Wireless FM Transmitter,_,Panasonic BB-HCM331A Outdoor Network Camera with 2-Way Audio,Color - CCD - Cable,_
22183,211,174,KitchenAid Pasta Roller And Cutter - KPRA,KitchenAid Pasta Roller And Cutter - KPRA/ One Pasta Roller/ Two Pasta Cutters/ Cleaning Brush/ Chrome Finish,_,"Panasonic NN-C994S Genius Prestige Convection Microwave Oven with Inverter Turbo Defrost and One-Touch Sensor Cooking, Stainless",_,_
22796,1032,179,Sharp AQUOS 52' D85U Series Black LCD Flat Panel HDTV - LC52D85U,"Sharp AQUOS 52' D85U Series Black LCD Flat Panel HDTV - LC52D85U/ Full HD 1080p (1920 x 1080) Resolution/ 10-Bit Advanced Super View/ 120Hz Fine Motion Enhanced/ Built-In ATSC/QAM/NTSC Tuners/ 60,000 Hours Lamp Life/ 10,000:1 Dynamic Contrast Ratio/ 4ms Response Time/ 3-Wavelength Back-Light System/ Black Finish",_,Techcraft Veneto Series SWP48 TV Stand,"Wood, Glass - Brown",$299.00
23259,161,183,Garmin 010-10702-00 Black GA 25MCX Remote GPS Antenna - 0101070200,Garmin 010-10702-00 Black GA 25MCX Remote GPS Antenna - 0101070200/ Built-In Magnetic Mount/ Includes A Cable Over 8 Feet Long And MCX Connector,$30.00,Nintendo DS Lite (Black Onyx) - USGSKB,_,_
