_id,ltable_id,rtable_id,ltable_name,ltable_description,ltable_price,rtable_name,rtable_description,rtable_price
81877,928,596,Nikon Graphite Black 14.5 Megapixel COOLPIX Digital Camera - COOLPIXS710BK,Nikon Graphite Black 14.5 Megapixel COOLPIX Digital Camera - COOLPIXS710BK/ 14.5 Effective Megapixels/ 3.6x Zoom-NIKKOR Lens/ 3.0' High-Resolution Wide-Viewing Angle LCD Monitor/ Optical Lens Shift VR Image Stabilization/ Food And Smile Mode/ Face-Priority AF/ Camera Red-Eye Fix/ D-Lighting/ Graphite Black Finish,_,Panasonic Lumix DMC-FS3 Digital Camera - Silver,"Panasonic DMC-FS3S 8 Megapixel Compact Digital Camera with 33mm Lens, 3x Optical Zoom, Intelligent Auto Mode and 2.5' Diagonal Intelligent LCD - Silver",$137.33
81916,1071,596,Sony VAIO LV Series Silver All-In-One Desktop Computer - VGCLV140J,Sony VAIO LV Series Silver All-In-One Desktop Computer - VGCLV140J/ 2.53GHz Intel Core 2 Duo E7200 Processor/ 4GB Memory/ Built-In 1.3 MP MOTION EYE Camera And Microphone/ 320GB Serial ATA Hard Drive/ 24' XBRITE-Full HD LCD/ Integrated Stereo A2DP Bluetooth Technology/ Two Built-In 5.5 Watt Stereo Speakers/ Microsoft Windows Vista Home Premium 64-Bit/ Silver Finish,_,Panasonic Lumix DMC-FS3 Digital Camera - Silver,"Panasonic DMC-FS3S 8 Megapixel Compact Digital Camera with 33mm Lens, 3x Optical Zoom, Intelligent Auto Mode and 2.5' Diagonal Intelligent LCD - Silver",$137.33
82049,714,597,Sony Black 1080p Upscaling DVD Player - DVPNS700HB,Sony Black 1080p Upscaling DVD Player - DVPNS700HB/ 1080p Upscaling Video Output Through HDMI Connection/ BRAVIA Sync/ High Resolution JPEG Output/ Precision Cinema Progressive Technology/ Precision Drive/ Child Lock/ Multi Disc Resume/ Multi Brand TV Remote Control/ Black Finish,_,Sony VAIO USB Docking Station - VGPUPR1,"4 x USB, 1 x Network, 1 x VGA, 1 x DVI-D, 1 x Microphone, 1 x Headphone, 1 x DC-in",$142.95
82610,547,600,Panasonic VIERA 50' Plasma Flat Panel HDTV In Black - TH50PX80U,Panasonic VIERA 50' Plasma Flat Panel HDTV In Black - TH50PX80U/ 720p Display/ 1366 x 768 Native Resolution/ Color Purity Optimizer/ Surround Sound/ Anti-Reflective Filter/ VIERA Link HDAVI Control/ Built-In NTSC/ATSC/QAM Tuners/ 3 HDMI Inputs/ Built-In GalleryPlayer Capable/ SD Card Memory Slot/ Pedestal Stand Included/ Black Finish,_,Panasonic VIERA TC-32LZ800 32' LCD TV,32' - 16:9 - 1920 x 1080,_
82802,329,601,Panasonic Yellow 4GB SDHC Memory Card - RPSDV04GU1K,Panasonic Yellow 4GB SDHC Memory Card - RPSDV04GU1K/ Class 6/ Up To 20MB/s Read-Out Or Write-In Data Transfer Rate/ 4GB Storage Capacity/ Yellow Finish,_,Panasonic VIERA TC-37LZ85 37' LCD TV,"37' - ATSC, NTSC - 16:9 - 1920 x 1080 - HDTV",$799.11
82821,511,601,Samsung DLP TV Stand In Black - TR72BX,"Samsung DLP TV Stand In Black - TR72BX/ Designed To Fit Samsung HLT7288 HLT7288, HL72A650, and HL67A650 Television Sets/ Tempered 6mm Tinted Glass Shelves/ Wide Audio Storage Shelves To Accommodate 4 Or More Components/ Wire Management System/ Easy To Assemble/ High Gloss Black Finish",$369.00,Panasonic VIERA TC-37LZ85 37' LCD TV,"37' - ATSC, NTSC - 16:9 - 1920 x 1080 - HDTV",$799.11
84456,784,610,Brenthaven Sling II Titanium Laptop Carrying Bag For 15' MacBook Pro - TR654ZMA,Brenthaven Sling II Titanium Laptop Carrying Bag For 15' MacBook Pro - TR654ZMA/ Lightweight And Durable Protective Case/ Rugged Ballistic Nylon/ Custom Fit Padded Computer Compartment/ External Pocket/ Side Water Bottle Pocket/ Ergonomic Strap With Tuck Away Option/ Internal Accessory Panel/ Fits MacBook Pro 15.4'/ Titanium Finish,_,Sony 16GB Memory Stick PRO Duo Card (Mark 2) - MSMT16G,16 GB,$110.99
84670,344,615,Panasonic Stainless Steel Luxury Full Size Countertop Microwave Oven - NNSD967SS,Panasonic Stainless Steel Luxury Full Size Countertop Microwave Oven - NNSD967SS/ 2.2 Cu. Ft Capacity/ 1250 Watts Cooking Power/ 10 Power Levels/ 5 Cooking Stages/ Quick Minute Feature/ Easy-To-Use Pop-Out Dial/ One-Touch Sensor Cooking/ Inverter Turbo Defrost/ Popcorn Key/ Stainless Steel Finish,_,Panasonic KX-TG4321B 5.8 GHz Expandable Digital Cordless Phone,1 x Phone Line(s) - Black,_
84739,614,615,Lasonic ATSC Digital To Analog TV Converter Box - LTA260,"Lasonic ATSC Digital To Analog TV Converter Box - LTA260/ Support 4:3 And 16:9 Video Format/ Composite Video And Stereo Audio Output/ Supports Channel Display, Closed Caption, EAS And Parental Controls (V-Chip)/ Display ANT Level And Signal Quality On The TV/ Black Finish",_,Panasonic KX-TG4321B 5.8 GHz Expandable Digital Cordless Phone,1 x Phone Line(s) - Black,_
85254,950,616,Canon PowerShot Silver Digital Camera - SX110IS,Canon PowerShot SX110 IS Silver Digital Camera - SX110IS/ 9.0 Megapixel/ 10x Optical Zoom Lens With Optical Image Stabilizer Technology/ 3.0' LCD Display/ DIGIC III Image Processor/ Face Detection/ Motion Detection/ 20 Shooting Modes Including 8 Special Scene Modes/ Red-Eye Correction/ Automatic ISO Settings/ Print-Share Button/ Power By AA Batteries For Convenient/ Silver Finish,_,Samsung L200 Digital Camera - Black - EC-L200ZBBA/US,"Samsung L200 10 Megapixel Digital Camera with 2.5 LCD, 3x Optical Zoom, Digital Image Stabilization, Face Detection Function - Black",$119.00
85804,626,618,Panasonic DECT 6.0 Expandable Digital Cordless Phone With All-Digital Answering System - KXTG9343T,Panasonic DECT 6.0 Expandable Digital Cordless Phone With All-Digital Answering System - KXTG9343T/ 3 Handsets System/ Up To 6 Multi-Handset Capability/ Digital Answering Machine System/ Ringer ID/ Call Waiting Caller ID/ Voicemail/ Hold/ Voice Menu/ Marker Message/ Mute/ Clock/ Alarm/ LED Lighting/ Night Mode/ Call Block/ Speakerphone/ 11 Days Standby/ 5 Hours Talk Time/ Black Metallic Finish,_,Sony Cyber-shot DSC-H10 Digital Camera - Black - DSCH10/B,8.1 Megapixel - 16:9 - 2x Digital Zoom - 3' Active Matrix TFT Color LCD,$213.72
86033,984,618,Canon PowerShot Black 14.7 Megapixel Digital Camera - SD990ISB,Canon PowerShot Black 14.7 Megapixel Digital Camera - SD990ISB/ 14.7 Megapixel/ 3.7x Optical Zoom/ Optical Image Stabilizer/ Optical Viewfinder/ Large High-Quality 2.5' PureColor LCD/ DIGIC 4 Image Processor/ Face Detection Self-Timer/ Intelligent Contrast Correction/ Quick Mode/ Print/Share Button/ Black Finish,_,Sony Cyber-shot DSC-H10 Digital Camera - Black - DSCH10/B,8.1 Megapixel - 16:9 - 2x Digital Zoom - 3' Active Matrix TFT Color LCD,$213.72
86374,978,619,Sony VAIO CS Series Red Notebook Computer - VGNCS110ER,Sony VAIO CS Series Red Notebook Computer - VGNCS110ER/ 2.0GHz Intel Core 2 Duo Processor T5800/ 14.1' (1280 x 800) XBRITE-ECO Widescreen Display/ 250GB Serial ATA 5400rpm Hard Drive/ Built-In 1.3 Megapixel MOTION EYE Camera And Microphone/ 3GB PC2-6400 (2GBx1 + 1GBx1) Installed Memory/ Integrated Stereo A2DP Bluetooth/ 800MHz Front Side Bus Speed/ 2MB L2 Cache/ Genuine Microsoft Windows Vista Home Premium 32-bit With SP1/ Red Finish,_,Sony Cyber-shot DSC-W120 Digital Camera - Silver - DSCW120,16:9 - 2x Digital Zoom - 2.5' Active Matrix TFT Color LCD,$106.42
86691,1027,620,Sony BD/DVD Home Theater System - BDVIS1000,"Sony BD/DVD Home Theater System - BDVIS1000/ S-AIR Wireless Capability/ XMB (Xross Media Bar) Graphical User Interface/ Precision Cinema HD With HDMI Upscaler/ 24p True Cinema/ Deep Color/ x.v.Color/ 480i/480p/576i/576p/720p/1080i/1080p(60Hz) Resolution With HDMI/ Dolby Digital, Dolby Digital Plus, Dolby TrueHD, DTS, DTS-HD High Resolution, DTS-HD Master Audio, LPCM 2ch, LPCM 6ch, LPCM 8ch Decoder With HDMI/ Black Finish",$999.00,Sony DSC-750 Cyber-shot Digital Camera - DSC750,_,$99.72
87078,723,622,Sony Black 9 Megapixel Cyber-Shot Digital Camera - DSCH50B,Sony Black 9 Megapixel Cyber-Shot Digital Camera - DSCH50B/ 9 Megapixels/ 3.0' Tilt-Up Clear Photo LCD Plus Display/ Carl Zeiss 15X Optical Zoom Lens/ 15 MB Internal Memory/ Versatile Long Distance Flash/ Smart Zoom/ In-Camera Red-Eye Correction/ Smile Shutter Technology/ Face Detection/ In-Camera Retouching/ Super SteadyShot Optical Image Stabilization/ Double Anti-Blur Solution/ HDTV Compatibility/ NightShot Infrared System/ Black Finish,_,Panasonic KX-TG9372B Expandable Digital Cordless Phone,1 x Phone Line(s) - Black,$86.54
87184,302,623,Olympus Silver Digital Voice Recorder - VN4100PC,Olympus Silver Digital Voice Recorder - VN4100PC/ 144 Hours 20 Minutes Recording Time/ PC Link/ File Management/ Timer Recording/ Four Recording Modes/ Voice Activation/ Silver Finish,_,Panasonic KX-TG9344T Expandable Digital Cordless Phone,1 x Phone Line(s),$116.21
87544,588,625,Panasonic Black 1080p Up-Conversion DVD Recorder - DMREZ28K,Panasonic Black 1080p Up-Conversion DVD Recorder - DMREZ28K/ Digital Tuner And 1080p Up-Conversion/ Simple Recording And Playback With VIERA Link/ Digital Camera Connection With SD Memory Card And USB Cable/ Super Multi Format Recording And Playback/ DivX Playback/ Auto Drive Select/ Black Finish,_,Panasonic KX-TG9342T Cordless Phone,"1 x Phone Line(s) - Black, Metallic",_
87557,626,625,Panasonic DECT 6.0 Expandable Digital Cordless Phone With All-Digital Answering System - KXTG9343T,Panasonic DECT 6.0 Expandable Digital Cordless Phone With All-Digital Answering System - KXTG9343T/ 3 Handsets System/ Up To 6 Multi-Handset Capability/ Digital Answering Machine System/ Ringer ID/ Call Waiting Caller ID/ Voicemail/ Hold/ Voice Menu/ Marker Message/ Mute/ Clock/ Alarm/ LED Lighting/ Night Mode/ Call Block/ Speakerphone/ 11 Days Standby/ 5 Hours Talk Time/ Black Metallic Finish,_,Panasonic KX-TG9342T Cordless Phone,"1 x Phone Line(s) - Black, Metallic",_
87596,107,626,Panasonic Genius Countertop Microwave In Black - NNH965BK,Panasonic Genius Countertop Microwave - NNH965BK/ 2.2 Cubic Foot/ Inverter Turbo Defrost/ Child Safety Lock/ Versatile Function Key/ Black Finish/,_,Panasonic KX-TG9341T Cordless Phone,"1 x Phone Line(s) - Black, Metallic",_
87697,1017,626,Panasonic VIERA 58' 1080p Plasma HDTV In Black - TH58PZ850U,"Panasonic VIERA 58' 1080p Plasma HDTV In Black - TH58PZ850U/ 1920 x 1080 Resolution/ 1,000,000:1 Dynamic Contrast Ratio/ VIERA Cast Internet TV Capability/ VIERA Link HDAVI Control/ Surround Sound/ BBE ViVA HD3D Sound/ Built-In Closed Caption Decoder/ Built-In SD Card Memory Slot/ Built-In NTSC/ATSC/QAM Tuners/ Black Finish",_,Panasonic KX-TG9341T Cordless Phone,"1 x Phone Line(s) - Black, Metallic",_
87846,646,627,Canon Silver 10 Megapixel PowerShot Digital Camera - SD890IS,Canon Silver 10 Megapixel PowerShot Digital Camera - SD890IS/ 10.0 Megapixel/ 5x Optical Zoom/ Optical Image Stabilizer/ 2.5' PureColor LCD/ Face Detection Technology/ Motion Detection Technology/ DIGIC III Image Processor/ Red-Eye Correction/ Silver Finish,_,Panasonic KX-TG9332S DECT 6.0 Expandable Digital Cordless Phone,1 x Phone Line(s) - Silver,_
88005,617,628,Panasonic 5.8 GHz Black Expandable Digital Cordless Phone - KXTG4321B,Panasonic 5.8 GHz Black Expandable Digital Cordless Phone - KXTG4321B/ Multi-Handset Capability/ Digital Answering Machine System/ Ringer ID/ Call Waiting Caller ID/ Voicemail/ Hold/ Mute/ Clock/ Alarm/ LED Lighting/ Speakerphone/ Intercom/ 11 Days Standby/ 5 Hours Talk Time/ Black Finish,_,Panasonic KX-TG9333T Cordless Phone - KX-TG9333T,Panasonic DECT 6.0 1.9GHz Expandable Cordless Phone with Digital Answering System,_
88164,108,630,Panasonic Genius Countertop Microwave In White - NNH965WH,Panasonic Genius Countertop White Microwave - NNH965WH/ 2.2 Cubic Foot/ Inverter Turbo Defrost/ Child Safety Lock/ Versatile Function Key/ White Finish,_,Panasonic KX-TG9348T Expandable Digital Cordless Phone,1 x Phone Line(s) - Metallic Black,_
88198,302,630,Olympus Silver Digital Voice Recorder - VN4100PC,Olympus Silver Digital Voice Recorder - VN4100PC/ 144 Hours 20 Minutes Recording Time/ PC Link/ File Management/ Timer Recording/ Four Recording Modes/ Voice Activation/ Silver Finish,_,Panasonic KX-TG9348T Expandable Digital Cordless Phone,1 x Phone Line(s) - Metallic Black,_
88665,634,632,Onkyo 6 Disc CD Player Changer - DXC390B,Onkyo 6 Disc CD Player Changer- DXC390B/ Multi Single-Bit DAC/ 6 Repeat Modes/ 40 Random Track Memory/ Direct Track Access/ 96 dB S/N Ratio/ 5 Hz-20 kHz Frequency Response/ Remote Control Included/ Black Finish,_,"ONKYO 6-DISC CD CHANGER W/VLSC, BLACK NIC - DX-C390",_,$179.72
88863,1024,632,Sony Black Speaker Dock And Clock Radio For iPod And iPhone - ICFC1IPMK2BLK,Sony ICFC1IPMK2 Black Speaker Dock And Clock Radio For iPod And iPhone - ICFC1IPMK2BLK/ Unique Adjustable Backstop For iPods/ 3 Wake-Sleep Sound Alert Options/ Digital AM-FM Tuner/ Alarm Clock/ Automatic Time Set/ Automatic Daylight Savings Time/ Battery Charger/ Audio Input/ Black Finish,_,"ONKYO 6-DISC CD CHANGER W/VLSC, BLACK NIC - DX-C390",_,$179.72
89407,285,634,Transcend JetFlash V10 8GB USB Flash Drive - TS8GJFV10,Transcend JetFlash V10 8GB USB Flash Drive - TS8GJFV10/ Hi-Speed USB 2.0/ Capless Sliding Design Protects The Connector/ Easy Plug And Play Installation/ AES Encryption/ DataBackup Function/ Keychain Hook And Neck Strap/ Black Finish,_,Apple Time Capsule Network Hard Drive - MB277LL/A,1TB - Type A USB,$439.00
89473,47,635,Sanus 13' - 30' VisionMount Flat Panel TV Silver Wall Mount - VMFS,Sanus 13' - 30' VisionMount Flat Panel TV Silver Wall Mount - VMFS/ Supports Up To 40 lbs/ Easy To Install/ Fingertip Virtual Axis Tilting System/ Silver Finish,$39.99,Samsung LN46A650 46' LCD TV,"Samsung LN46A650 - 46' 1080p LCD HDTV - 50,000:1 Dynamic Contrast Ratio - 120Hz - 4ms Response Time","$1,599.98"
90230,672,639,Samsung 26' Black Flat Panel Series 4 LCD HDTV - LN26A450,"Samsung 26' Black Flat Panel Series 4 LCD HDTV - LN26A450/ 5,000:1 Dynamic Contrast Ratio/ 1366 x 768 True 720p Resolution/ 8mm Response Time/ Cold Cathode Fluorescent Lamp (CCFL)/ Hidden Bottom Speakers/ SRS TruSurround XT/ Built-In ATSC/Clear QAM Tuner/ V-Chip System/ Black Finish",_,Samsung HT-Z510 Home Theater System,"DVD Player, 5.1 Speakers - 5 Disc(s) - Progressive Scan - 1200W RMS - Dolby Digital, Dolby Pro Logic II, DTS",$321.55
90265,749,639,Panasonic Black Blu-ray Disc Theater Sound System - SCBT100,Panasonic Black Blu-ray Disc Theater Sound System - SCBT100/ Full Audio Codec For Blu-ray Disc/ Full-HD 1080p/ Virtual 7.1 Channel Surround With 5 Speakers/ Integrated Universal Dock For iPod/ On-Screen Display For iPod Music Menu/ iPod Video Playback/ SD Memory Card Slot/ Powerful Bass Sound 'Kelton Subwoofer'/ 'Bamboo Diaphragm' Center And Front Speakers/ Wireless Rear Speaker System/ Whisper-Mode Surround/ Black Finish,_,Samsung HT-Z510 Home Theater System,"DVD Player, 5.1 Speakers - 5 Disc(s) - Progressive Scan - 1200W RMS - Dolby Digital, Dolby Pro Logic II, DTS",$321.55
91191,906,645,Samsung 52' Series 8 LCD Black Flat Panel HDTV - LN52A850,"Samsung 52' Series 8 LCD Black Flat Panel HDTV - LN52A850/ Full 1080p (1920x1080) Resolution/ Touch Of Color/ Auto Motion Plus 120Hz/ 50,000:1 Dynamic Contrast Ratio/ 4ms Response Time/ SRS Trusurround XT/ Built-In Digital Tuner (ATSC/Clear QAM)/ Black With Red Accent Finish",_,SAMSUNG DVD HM THEATER SYS 5 DISC NIC - HT-Z410/XAA,_,$235.14
91512,833,646,Panasonic VIERA 46' Black Plasma Flat Panel 1080p HDTV - TH46PZ850U,"Panasonic VIERA 46' Black Plasma Flat Panel 1080p HDTV - TH46PZ850U/ 1,920 x 1,080 Resolution/ 1,000,000:1 Dynamic Contrast Ratio/ 5,120 Equivalent Shades Of Gradation/ 24p Cinematic Playback/ x.v.Color/ Motion Adaptive 3D Y/C Digital Comb Filter/ Motion Pattern Noise Reduction/ Black Finish",_,"Samsung LN52A550 - 52' Widescreen 1080p LCD HDTV - 30,000:1 Dynamic Contrast Ratio - 5ms Response Time - Piano Black",_,"$1,579.00"
91812,54,648,Sanus 32' - 50' Flat Panel TV Black Wall Mount - VMPL50B,Sanus 32' - 50' Flat Panel TV Black Wall Mount - VMPL50B/ Solid Heavy-Gauge Steel Construction/ Durable Powder-Coated Finish/ Virtual Axis Tilt Adjustment System/ Supports Up To 130 Lbs/ Black Finish,_,OmniMount Stellar G303 Series 3 Shelf Component Stand - Black - G303 DARK,_,$299.95
92407,160,650,Canon Black Leather Camera Case - 1588B001,Canon Black Leather Camera Case - 1588B001/ Compatible With Canon Digital ELPH Cameras/ Protects Your Camera From Dust And Scratches/ Wrist Strap For Easy Portability/ Black Finish,_,Canon EOS Rebel XSi Digital SLR Camera with EF-S 18-55mm f/3.5-5.6 IS Lens - Silver - 2757B003,Canon EOS Rebel XSi 12 Megapixel Digital SLR Camera with 18-55mm IS Lens - Silver,$649.88
92409,171,650,Panasonic Digital Camera Battery - CGAS007A1B,Panasonic Digital Camera Battery - CGAS007A1B/ Lithium Ion Type/ For Digital Camera DMCTZ1 And DMCTZ3,_,Canon EOS Rebel XSi Digital SLR Camera with EF-S 18-55mm f/3.5-5.6 IS Lens - Silver - 2757B003,Canon EOS Rebel XSi 12 Megapixel Digital SLR Camera with 18-55mm IS Lens - Silver,$649.88
92837,505,651,Uniden DECT 6.0 Digital Accessory Handset  - DCX300,Uniden DECT 6.0 Digital Accessory Handset - DCX300/ DECT 6.0 Interference Free Cordless Frequency/ Large Color Display/ Blue Backlit Keypad/ Handset Speakerphone/ Intercom or Call Transfer Between Handsets/ Polyphonic Ring Tones/ Advanced Phonebook Features/ Last 5 Number Redial/ Piano Black Finish,$34.00,Canon EOS Rebel XSi Digital SLR Camera with EF-S 18-55mm f/3.5-5.6 IS Lens - Black - 2756B003,Canon EOS Rebel XSi 12 Megapixel Digital SLR Camera with 18-55mm IS Lens - Black,$649.88
93134,979,651,Samsung 46' Series 9 LCD Black Flat Panel HDTV - LN46A950,"Samsung 46' Series 9 LCD Black Flat Panel HDTV - LN46A950/ Full 1080p High Definition Resolution/ 1,000,000:1 Dynamic Contrast Ratio/ Auto Motion Plus 120Hz/ Built-In Digital Tuner (NTSC/ATSC/Clear QAM)/ 4ms Response Time/ SRS TruSurround XT/ Down Firing Speakers/ Picture-In-Picture (PIP)/ Integrated Woofer/ Wide Color Gamut LED Backlight/ Black Finish",_,Canon EOS Rebel XSi Digital SLR Camera with EF-S 18-55mm f/3.5-5.6 IS Lens - Black - 2756B003,Canon EOS Rebel XSi 12 Megapixel Digital SLR Camera with 18-55mm IS Lens - Black,$649.88
93138,984,651,Canon PowerShot Black 14.7 Megapixel Digital Camera - SD990ISB,Canon PowerShot Black 14.7 Megapixel Digital Camera - SD990ISB/ 14.7 Megapixel/ 3.7x Optical Zoom/ Optical Image Stabilizer/ Optical Viewfinder/ Large High-Quality 2.5' PureColor LCD/ DIGIC 4 Image Processor/ Face Detection Self-Timer/ Intelligent Contrast Correction/ Quick Mode/ Print/Share Button/ Black Finish,_,Canon EOS Rebel XSi Digital SLR Camera with EF-S 18-55mm f/3.5-5.6 IS Lens - Black - 2756B003,Canon EOS Rebel XSi 12 Megapixel Digital SLR Camera with 18-55mm IS Lens - Black,$649.88
93216,181,652,Tech Craft Avalon Series TV Stand - SWP48,Tech Craft Avalon Series TV Stand - SWP48/ 48' Wide Credenza For Flat Panel TVs And DLPs/ 260 Lbs TV Weight Capacity/ 50 Lbs Shelf Weight Capacity/ Wood Veneer Finish,$299.00,Samsung 4 Series LN37A450 37' LCD TV,"Samsung LN37A450 - 37' Widescreen 720p LCD HDTV - 10,000:1 Dynamic Contrast Ratio - 6ms Response Time - Piano Black",$796.82
93794,642,656,Samsung 5 Disc Home Theater Surround Sound System - HTZ510,Samsung 5 Disc Home Theater Surround Sound System - HTZ510/ 5-Disc DVD Changer/ HDMI Output/ 5.1 Channel Home Theater Audio System/ Multimedia Disc Playback/ XM Satellite Radio-Ready/ Wireless Ready/ iPod Connectivity Compatible/ Black Finish,_,Samsung 5 Series LN37A550 37' LCD TV,"Samsung LN37A550 - 37' Widescreen 1080p LCD HDTV - 15,000:1 Dynamic Contrast Ratio - 5ms Response Time - Piano Black",$944.00
94954,295,663,Coby 7' Black Widescreen TFT Portable DVD CD MP3 Player - TFDVD7006,"Coby 7' Black Widescreen TFT Portable DVD CD MP3 Player - TFDVD7006/ Compact Portable Design/ 480 x 240 Display Resolution/ 16:9 Widescreen TFT Color Display/ DVD, DVD?R/RW, CD, CD-R/RW, JPEG And MP3 Compatible/ Anti-Skip Circuitry/ Dolby Digital Decoder/ Digital And Analog AV Outputs/ NTSC/PAL Video System/ Black Finish",$97.00,"Handycam HDR-UX10 DVD Camcorder (15x Opt, 180x Dig, 2.7' LCD) - HDRUX10",_,$768.24
95498,784,666,Brenthaven Sling II Titanium Laptop Carrying Bag For 15' MacBook Pro - TR654ZMA,Brenthaven Sling II Titanium Laptop Carrying Bag For 15' MacBook Pro - TR654ZMA/ Lightweight And Durable Protective Case/ Rugged Ballistic Nylon/ Custom Fit Padded Computer Compartment/ External Pocket/ Side Water Bottle Pocket/ Ergonomic Strap With Tuck Away Option/ Internal Accessory Panel/ Fits MacBook Pro 15.4'/ Titanium Finish,_,Speck Products SeeThru Case for Apple MacBook Air - MBA-CLR-SEE,Plastic - Clear,_
95789,734,669,Z-Line Portland Black TV Stand - ZL2344MU,Z-Line Portland Black TV Stand - ZL2344MU/ Accommodates Most Flat Panel LCD/Plasma TVs Up To 50'/ Durable Black Glossy Powder Coat Metal Frame/ Tempered Black Safety Glass Shelves/ Chrome Cylinder Glass Supports/ Swivel Mount/ Wire Management/ Holds 65 lbs Per Shelf/ Distance Between Shelves- 8.25' (Bottom to Middle) and 7' (Middle to the bar below the top shelf)/ Black Finish,$399.00,Samsung 4 Series LN26A450 26' LCD TV,Samsung LN26A450 - 26' Widescreen 720p LCD HDTV - 5000:1 Dynamic Contrast Ratio - 8ms Response Time - Piano Black,$549.00
95849,990,669,Samsung 46' Series 8 LCD Black Flat Panel HDTV - LN46A860,"Samsung 46' Series 8 LCD Black Flat Panel HDTV - LN46A860/ Touch Of Color Design/ Full 1080p High Definition Resolution/ 50,000:1 Dynamic Contrast Ratio/ Auto Motion Plus 120Hz/ Built-In Digital Tuner (ATSC/Clear QAM)/ 4ms Response Time/ SRS TruSurround XT/ Down Firing Speakers/ Slim Depth And Narrow Bezel/ Black With Blue Finish",_,Samsung 4 Series LN26A450 26' LCD TV,Samsung LN26A450 - 26' Widescreen 720p LCD HDTV - 5000:1 Dynamic Contrast Ratio - 8ms Response Time - Piano Black,$549.00
95851,1012,669,Sony 42' BRAVIA V Series Black LCD Flat Panel HDTV - KDL42V4100,Sony 42' BRAVIA V Series Black LCD Flat Panel HDTV - KDL42V4100/ 1920 x 1080 Full HD 1080p Resolution/ Digital Media Extender (DMex)/ BRAVIA Engine Technology/ Advanced Contrast Enhancer (ACE)/ Enhanced (XMB) User Interface With Rich 3D Graphics/ 24p True Cinema/ Black Finish,_,Samsung 4 Series LN26A450 26' LCD TV,Samsung LN26A450 - 26' Widescreen 720p LCD HDTV - 5000:1 Dynamic Contrast Ratio - 8ms Response Time - Piano Black,$549.00
95952,829,670,Sony 46' BRAVIA S-Series Black LCD Flat Panel HDTV - KDL46S4100,"Sony 46' BRAVIA S-Series Black LCD Flat Panel HDTV - KDL46S4100/ 1920 x 1080 Full HD Resolution/ 24p True Cinema/ ATSCTM/NTSC Tuner With QAM/ 2,500:1 Contrast Ratio/ CineMotion Reverse 3:2 Pulldown Technology/ 3D Comb Filter/ MPEG Noise Reduction/ Black Finish",_,Coby Electronics TF-TV1022 10.2' LCD TV - TFTV1022,"10.2' - Active Matrix TFT - ATSC, NTSC - 16:9 - 800 x 480 - HDTV",$119.99
96605,691,675,Tech Craft Veneto Series Black TV Stand - ABS60BK,Tech Craft Veneto Series Black TV Stand - ABS60BK/ Supports Up To A 60' Flat Panel TV/ Molded Top Gives It An Elegant Appearance/ Framed Doors To Conceal Components/ 200 Lbs Top Shelf Capacity/ Black Finish,$399.00,Samsung 4 Series LN22A451 22' LCD TV,"Samsung LN22A451 - 22' Widescreen LCD HDTV - 3,000:1 Dynamic Contrast Ratio - 8ms Response Time - White",$399.00
96713,582,676,Toshiba White 19' LCD HDTV DVD Combo - 19LV506,Toshiba White 19' LCD HDTV DVD Combination - 19LV506/ 19' Diagonal Widescreen TFT LCD Display/ Built-In Slot Loading DVD Player/ Built-In ATSC/NTSC/QAM digital Tuner/ Official DivX Certified/ PC Input/ JPEG Viewer/ White Finish,_,Sharp LC26DV24U 26' TV/DVD Combo,Sharp LC-26DV24U - 26' Widescreen TV/DVD Combo HDTV - 800:1 Contrast Ratio - 8ms Response Time - Piano Black,$508.72
97050,905,680,Samsung 46' Series 8 LCD Black Flat Panel HDTV - LN46A850,"Samsung 46' Series 8 LCD Black Flat Panel HDTV - LN46A850/ 1920 x 1080p Full HD Resolution/ Touch Of Color Design/ Pre-Loaded Content Library/ DLNA/ Super Slim Depth Narrow Bezel/ Auto Motion Plus 120Hz/ 50,000:1 Dynamic Contrast Ratio/ 4ms Response Time/ SRS TruSurround/ Built-In Digital Tuner (ATSC/Clear QAM)/ Black With Red Accent Finish",_,Samsung 6 Series HL61A650 61' Projection TV,Samsung HL61A650 - 61' Widescreen 1080p DLP HDTV w/ Built in NTSC/ATSC Tuner - Piano Black,"$1,076.94"
97365,904,681,Samsung 7.1-Channel Blu-ray Home Theater System - HTBD2TXAA,Samsung HT-BD2T 7.1-Channel Blu-ray Home Theater System - HTBD2TXAA/ 1100 Watts Total System Power/ Dolby True HD And DTS-HD Compatibility/ 1080 DVD Up-Conversion With HDMI/ Full HD 1080p/24p Playback/ Black Finish,_,Samsung LN19A450 19' LCD TV,Samsung LN19A450 - 19' Widescreen 720p LCD HDTV - 3000:1 Dynamic Contrast Ratio - 8ms Response Time - Piano Black,$348.00
97464,642,682,Samsung 5 Disc Home Theater Surround Sound System - HTZ510,Samsung 5 Disc Home Theater Surround Sound System - HTZ510/ 5-Disc DVD Changer/ HDMI Output/ 5.1 Channel Home Theater Audio System/ Multimedia Disc Playback/ XM Satellite Radio-Ready/ Wireless Ready/ iPod Connectivity Compatible/ Black Finish,_,Samsung 6 Series LN19A650 19' LCD TV,"Samsung LN19A650 - 19' Widescreen LCD HDTV - 3,000:1 Dynamic Contrast Ratio - 8ms Response Time",$369.00
97946,320,685,Audiovox 9' LCD Drop Down TV With Built-In DVD - VE927,"Audiovox 9' LCD Drop Down TV With Built-In DVD - VE927/ 16:9 Aspect Ratio/ ATSC/NTSC Tuner/ AM/FM Clock Radio/ Stereo Speakers/ Cooking Timer/ Plays DVD, CD, CDR, CDRW Disc/ Remote Control",_,Samsung LN32A550 32' LCD TV,"Samsung LN32A550 - 32' Widescreen 1080p LCD HDTV - 15,000:1 Dynamic Contrast Ratio - 5ms Response Time - Piano Black",$849.00
98116,202,686,Garmin StreetPilot C330 Dash Mount - Black Finish - 0101061300,Garmin StreetPilot C330 Dash Mount - 0101061300/ Non-Skid Mount Design/ Fully Portable/ Includes 12/24 Volt Cigarette Lighter Adapter/ Black Finish,$57.00,"Samsung PN42A450 - 42' Widescreen 720p Plasma HDTV - 100,000:1 Dynamic Contrast Ratio - Piano Black - PN42A450P",_,$899.99
98304,706,686,Griffin Black TuneBuds Mobile For iPod And iPhone - 9410TUNBMBLB,Griffin Black TuneBuds Mobile For iPod And iPhone - 9410TUNBMBLB/ Compatible With iPhone And iPod/ Three Sizes Of Cushioned Silicone Earpads/ High-Sensitivity Microphone/ ControlMic Button/ Earphone Cable/ Black Finish,_,"Samsung PN42A450 - 42' Widescreen 720p Plasma HDTV - 100,000:1 Dynamic Contrast Ratio - Piano Black - PN42A450P",_,$899.99
