_id,ltable_id,rtable_id,ltable_name,ltable_description,ltable_price,rtable_name,rtable_description,rtable_price
42980,779,339,LG 30' Stainless Steel Freestanding Gas Range - LRG30357SS,LG 30' Stainless Steel Freestanding Gas Range - LRG30357SS/ 5.0 Cu. Ft. Capacity Oven/ SuperBoil Burner/ 5 Burner System/ SmoothTouch Controls/ Warming Drawer/ Electronic Ignition System/ One Piece Recessed Cooktop/ Self-Cleaning Oven/ Stainless Steel Finish,_,Panasonic NNSD667S 1.2 cu. ft. Countertop Microwave Oven In Stainless Steel,_,_
43435,675,342,Panasonic VIERA 50' Plasma Flat Panel Black HDTV - TH50PZ800U,"Panasonic VIERA 50' Plasma Flat Panel Black HDTV - TH50PZ800U/ 1920 x 1080 Full HD Resolution/ One-Sheet Glass Design/ Anti-Reflective Screen/ 4096 Shades of Gradation/ 1,000,000:1 Dynamic Contrast Ratio/ 24p Film Mode/ THX Certified/ VIERA Link/ Deep Color/ x.v.Color/ Digital Comb Filter/ 3D Color Management/ Motion Pattern Noise Reduction/ Black Finish",_,Panasonic 2.2 cu. ft. Stainless Steel Luxury Full Size Countertop Microwave Oven - NNSD967SS,_,_
43760,687,343,Samsung 22' Black Flat Panel Series 6 LCD HDTV - LN22A650,"Samsung 22' Black Flat Panel Series 6 LCD HDTV - LN22A650/ 1680 x 1050 True 720p Resolution/ 5,000:1 Dynamic Contrast Ratio/ SRS TruSurround XT/ Built-In Digital Tuner (ATSC/Clear QAM)/ Wide Color Enhancer/ 8ms Response Time/ Touch Of Color Design/ Black With Red Finish",$599.00,Panasonic NNSN667B 1.2 cu. ft. Countertop Microwave Oven In Black,_,$108.63
43963,1052,343,Onkyo THX Ultra2 Certified 7.1 Channel Home Theater Black Receiver - TXNR906B,"Onkyo THX Ultra2 Certified 7.1 Channel Home Theater Black Receiver - TXNR906B/ 145W x 7/ HDMI v1.3/ All Discrete Circuitry/ Absolute Ground Plate/ Optimum Gain Volume/ Audyssey Dynamic EQ/ Non-Scaling Configuration/ Toroidal Transformer/ Dolby Digital Plus, Dolbyl TrueHD, DTS-HD Master Audio, DTS-HD High Resolution Audio Decoder/ Music Optimizer/ HDMI Deep Color Capable (36bit)/ 1080p Upscaling Via HDMI/ Analog To HDMI Upconversion/ Permanent Memory Storage/ Back-Lit Remote/ Black Finish",_,Panasonic NNSN667B 1.2 cu. ft. Countertop Microwave Oven In Black,_,$108.63
45015,434,352,Sony Lithium-Ion Rechargeable Battery Pack - NPFD1,"Sony Lithium-Ion Rechargeable Battery Pack - NPFD1/ InfoLITHIUM Long-Lasting Lithium-Ion Battery/ Compatilble With Sony Cyber-Shot DSCT2 Series, DSC-T70 Series, And DSC-T200 Series",_,Nikon EN-EL10 No-Mem Lithium-Ion Camera Battery - 25752,Lithium Ion (Li-Ion) - 3.7V DC - Photo Battery,$21.26
45456,433,360,Canon Deluxe Black Digital Camera Case - 2595B002,Canon Deluxe Black Digital Camera Case - 2595B002/ Soft Nylon Case/ Flip-Down Cover/ Belt Loop Attachment For Hands-Free Convenience/ Compatible With Canon PowerShot A Series/ Black Finish,$13.99,Canon FAX-JX200 Fax Machine - 1735B002AA,Monochrome Copier - 1.33 cpm Mono - Inkjet,_
45507,5,1083,Netgear Prosafe 16 Port 10/100 Rackmount Switch - Black Finish - JFS516NA,"Netgear Prosafe 16 Port 10/100 Rackmount Switch - JFS516NA/ Sixteen Switched Ports Provide Private Bandwidth For PCs, Servers Or Hubs/ Store-And-Forward Packet Switching/ Compatible With All Major Network Software/ Auto Detects Speed And Duplex/ Black Finish",$131.00,Canon PG-40 Twin Pack Black Ink Cartridge - 0615B013,Black,_
45579,205,1083,Denon 5 Disc CD Player - Black Finish - DCM390,"Denon 5 Disc CD Player - DCM390/ CD-R/RW Playback/ MP3, WMA And HDCD Decoding/ Advanced Multilevel Noise Shaping DAC/ 8 Times Oversampling Digital Filter/ 3 Mode Random Playback/ Intelligent Disc Scan/ 20 Selection Music Calendar Display/ Black Finish",$349.00,Canon PG-40 Twin Pack Black Ink Cartridge - 0615B013,Black,_
45748,641,1083,Samsung 52' Series 6 LCD Black Flat Panel HDTV - LN52A650,"Samsung 52' Series 6 LCD Black Flat Panel HDTV - LN52A650/ Full 1080p High Definition Resolution/ 16:9 Widescreen Aspect Ratio/ 50,000:1 Dynamic Contrast Ratio/ 4ms Response Time And Auto Motion Plus 120Hz Technology/ SRS TruSurround XT Audio/ Built-In Digital Tuner (ATSC/Clear QAM)/ Picture-In-Picture/ Auto Volume Leveler/ 4 HDMI Slots/ Swivel Stand/ Piano Black With Hint Amber Finish",_,Canon PG-40 Twin Pack Black Ink Cartridge - 0615B013,Black,_
46266,15,365,Belkin F3H982-25 Black 25 Ft Pro Series High Integrity VGA/SVGA Monitor Replacement Cable - F3H98225,Belkin F3H982-25 Black 25 Ft Pro Series High Integrity VGA/SVGA Monitor Replacement Cable - F3H98225/ Constructed Of 3 Coaxial And 5 Twisted Pair Cable/ Compatible With The PC/ Aluminum Undermold Shield/ Double Shielding/ Gold Plated Copper Contacts,_,Kenwood iPod Direct Cable - kcaip200,"1 x Proprietary - 1 x Mini-phone Stereo, 1 x Type A",$19.72
47297,1077,371,Sony VAIO FW Series Black Notebook Computer - VGNFW378JB,Sony VAIO FW Series Black Notebook Computer - VGNFW378JB/ 2.40GHz Intel Core 2 Duo processor P8600/ 16.4' (1920 x 1080) XBRITE-FullHD Widescreen Display/ 320GB Serial ATA 7200rpm Hard Drive/ Built-In 1.3 Megapixel MOTION EYE Camera And Microphone/ 4GB PC2-6400 (2GBx2) Installed Memory (Maximum Up To 8GB)/ 1066MHz Front Side Bus Speed/ 3MB L2 Cache/ Blu-ray Disc Support (Read / Write 2x Max)/ Genuine Microsoft Windows Vista Home Premium 64-Bit/ Black Finish,_,Computer Speakers - SRSA212/BLK,_,$22.53
47321,123,372,Sony VAIO VGP-PRSZ1 SZ Series Docking Station - VGPPRSZ1,"Sony VAIO VGP-PRSZ1 SZ Series Docking Station - VGPPRSZ1/ Compatible With SZ Series Notebooks/ Expand Connectivity To Your Notebook/ 3 USB 2.0, Gigabit Ethernet, VGA, DVI-D And DC In/ Black Finish",$199.00,Sony MDR-Q68LW Stereo Earphone - MDRQ68LW,_,$19.05
47798,617,374,Panasonic 5.8 GHz Black Expandable Digital Cordless Phone - KXTG4321B,Panasonic 5.8 GHz Black Expandable Digital Cordless Phone - KXTG4321B/ Multi-Handset Capability/ Digital Answering Machine System/ Ringer ID/ Call Waiting Caller ID/ Voicemail/ Hold/ Mute/ Clock/ Alarm/ LED Lighting/ Speakerphone/ Intercom/ 11 Days Standby/ 5 Hours Talk Time/ Black Finish,_,Logitech Digital Precision PC Gaming Headset - 981-000040,Logitech Digital Precision PC Headset,$31.99
48224,457,381,Sirius STILETTO 2 Portable Satellite Radio - SL2PK1,Sirius STILETTO 2 Portable Satellite Radio - SL2PK1/ SIRIUS Replay Controls/ Record Up To 100 Hours/ Stores Up To 10 Hours Of Individual Songs/ 2GB Internal Memory/ Personalized Sports Ticker/ SRS TruBass And 3D Focus Technologies/ WiFi/ Black Finish,_,Audiovox Satellite Radio Tuner,TERK XMRVRFM002 CommanderMT Universal In-Car XM Receiver,_
48432,726,384,Kensington Mini Battery Pack And Charger For iPhone And iPod - K33442US,"Kensington Mini Battery Pack And Charger For iPhone And iPod - K33442US/ Includes Retractable USB Charging Cable/ High-Capacity, Rechargeable Lithium-Ion Polymer Battery Pack/ LED Battery Meter/ Cap Converts Into A Kickstand/ Black Finish",_,UNIDEN DCX200 DECT 6.0 Accessory Handset & Charger,_,_
48591,124,387,Sony Digital Photo Printer Paper 40 Pack  - SVMF40P,Sony Digital Photo Printer Paper 40 Pack - SVMF40P/ 4' x 6' Print Paper With Snap-Off Edges/ Super Coat 2 Protective Lamination/ Water Damage And Fingerprint Resistant Prints/ 40 Sheets Of Paper And Print Ribbon/ For DPPF Series Digital Photo Printers Only,_,Sony PSP Core System (Piano Black) (Slim Model with AV Video Out Port) - 98510,_,_
48883,697,387,Sony Pink Earbud Style Headphones - MDREX55P,Sony MDREX55PNK Pink Earbud Style Headphones - MDREX55P/ 9mm EX Driver Provides Comfort Fit And Deep Bass Sound/ Soft Fitting Silicon Housing/ 3 Sizes Earbuds/ Carrying Pouch/ Pink Finish,_,Sony PSP Core System (Piano Black) (Slim Model with AV Video Out Port) - 98510,_,_
49412,436,390,Sony LCS-CSJ Black Soft Carrying Case - LCSCSJ,"Sony LCS-CSJ Black Soft Carrying Case - LCSCSJ/ Compatible With S, W, T, And N Series Digital Cameras/ Durable Nylon Construction/ Convenient Front Pocket/ Black Finish",_,Nikon Digital Camera Leather Case - 5811,Leather - Black,$7.99
49475,669,390,Speck SeeThru Clear Hard Shell Case For MacBook Air - MBACLRSEE,Speck SeeThru Clear Hard Shell Case For MacBook Air - MBACLRSEE/ Thin And Sleek Protective Case/ Access To All Ports/ 2-Piece Snap On/ Clear Finish,_,Nikon Digital Camera Leather Case - 5811,Leather - Black,$7.99
50012,625,393,Panasonic DECT 6.0 Expandable Digital Cordless Phone With All-Digital Answering System - KXTG9344T,Panasonic DECT 6.0 Expandable Digital Cordless Phone With All-Digital Answering System - KXTG9344T/ 4 Handsets System/ Up To 6 Multi-Handset Capability/ Digital Answering Machine System/ Ringer ID/ Call Waiting Caller ID/ Voicemail/ Hold/ Voice Menu/ Marker Message/ Mute/ Clock/ Alarm/ LED Lighting/ Night Mode/ Call Block/ Speakerphone/ 11 Days Standby/ 5 Hours Talk Time/ Black Metallic Finish,$139.00,Logitech MX Air Rechargeable Cordless Air Mouse - 931633-0403,Laser - USB,_
50035,39,394,Belkin Pro Series 16 Ft.  USB 2.0 Cable - F3U13316,Belkin Pro Series 16 Ft. USB 2.0 Device Cable - F3U13316/ Hi-Speed Data Transfer To 480Mbps/ Impedance Matched Twisted Pair Construction/ Gold Plated Copper Contacts/ 16 Feet,_,Monster Cable iCable A IC MINI IP-3 S Audio Stereo Cable - 123870,1 x Mini-phone Stereo - 1 x Mini-phone Stereo - 3ft,_
50166,74,396,Sanus 9' - 17' VisionMount Series Under Cabinet Flat Panel TV Silver Wall Mount - VMUC1S,Sanus 9' - 17' VisionMount Series Under Cabinet Flat Panel TV Silver Wall Mount - VMUC1S/ Tilting Motion/ Swivels Left And Right/ Universal Mounting Bracket/ Easy To Install/ Silver Finish,$99.99,Bracketron Nav-Mat Portable GPS Dash Mount - UFM-100-BL,Bracketron Nav-Mat - Portable GPS Dash Mount,_
50396,542,400,Canon PIXMA MX850 Multifunction Printer - MX850C,"Canon PIXMA MX850 Multifunction Printer - MX850C/ Advanced 5 In 1 Printer, Scanner, Copier, Fax Machine/ High Resolution Up To 9600 x 2400 Color Prints/ Auto-Image Fix/ Quick Start/ Memory Card Slot/ Grey And Black Finish",_,Canon PIXMA MX700 Multifunction Photo Printer - 2186B002,Canon Pixma MX700 Office All-in-One Printer,_
51120,389,405,Sony PSP 2000 Playstation Portable Gaming System Core 98510 In Piano Black - 711719851004,"Sony PSP 2000 Playstation Portable Gaming System Core 98510 In Piano Black - 711719851004/ Play Games, Watch Movies On UMD Discs, And Listen To Music All In One Device/ 4.3' LCD Screen (16:9)/ 480 x 272 Pixel/ Wi-Fi (IEEE 802.11b) For Wireless Networking With Other PSP Owners/ Memory Stick PRO Duo/ 333MHz System Clock Frequency/ Piano Black Finish",$185.00,Sony LCS-TWA/B Cyber-shot Camera Case - LCSTWA/B,Top Loading - Leather - Black,$34.00
51312,1008,405,Canon Black EOS 50D Digital SLR Camera Body - EOS50DBODY,Canon Black EOS 50D Digital SLR Camera Body - EOS50DBODY/ 15.1 Megapixel CMOS Sensor/ DIGIC 4 Image Processor/ 3.0' Clear View LCD/ 9 Cross-Type High-Precision Sensors/ Enhanced Live View/ EOS Integrated Cleaning System/ Creative Auto/ HDMI Output/ 2807B006/ Black Finish,_,Sony LCS-TWA/B Cyber-shot Camera Case - LCSTWA/B,Top Loading - Leather - Black,$34.00
51655,125,409,Canon Battery Charger - 0763B001,Canon Battery Charger - 0763B001/ Compatible With Canon NB-2L And NB-2LH Batteries,_,Canon EOS 40D Digital SLR Camera with EF 28-135mm f/3.5-5.6 IS USM Lens - 1901B017,Canon EOS 40D Digital SLR Camera with 28-135mm Lens,"$1,029.88"
51747,535,409,Canon Blue 8.0 Megapixel PowerShot Digital Camera - SD1100ISB,Canon Blue 8.0 Megapixel PowerShot Digital Camera - SD1100ISB/ 8.0 Megapixel/ 3x Optical Zoom/ 2.5' Color LCD/ 18 Shooting Modes/ Red-Eye Correction/ Face Detection Technology/ iSAPS Technology/ Rhythm & Blue Finish,_,Canon EOS 40D Digital SLR Camera with EF 28-135mm f/3.5-5.6 IS USM Lens - 1901B017,Canon EOS 40D Digital SLR Camera with 28-135mm Lens,"$1,029.88"
52540,252,416,LG WM0642HW 4.0 Cu Ft White Rear Control Washer - WM0642HWH,LG WM0642HW White Rear Control Washer - WM0642HWH/ 4.0 Cu. Ft. Capacity/ 7 Washing Programs/ 6 Temperature Levels/ RollerJets And Forced Water Circulation/ Upfront Electronic Control Panel With Dial-A-Cycle/ LoDecibel Quiet Operation/ SenseClean System/ White Finish,_,LG 4.0 cu. ft. Capacity Front Load Washer w/ Sanitary cycle,_,_
53236,554,418,Panasonic VIERA 42' Plasma Flat Panel HDTV In Black - TH42PX80U,Panasonic VIERA 42' Plasma Flat Panel HDTV In Black - TH42PX80U/ 720p Display/ 1024 x 768 Native Resolution/ Color Purity Optimizer/ Surround Sound/ Anti-Reflective Filter/ VIERA Link HDAVI Control/ Built-In NTSC/ATSC/QAM Tuners/ 3 HDMI Inputs/ Built-In GalleryPlayer Capable/ SD Card Memory Slot/ Pedestal Stand Included/ Black Finish,_,Sony MDREX81LP Comfort Fit Ear Hanger Headphones- Choose Color (Black),_,_
53509,1006,418,Apple 8GB Black 2nd Generation iPod Touch - MB528LLA,"Apple 8GB Black 2nd Generation iPod Touch - MB528LLA/ Holds Up To 1,750 Songs In 128-Kbps AAC Format, 10,000 iPod-Viewable Photos And 10 Hours Of Video/ Wi-Fi (802.11b/g)/ Nike + iPod Support Built-In/ Maps Location-Based Service/ 3.5' (Diagonal) Widescreen Multi-Touch Display/ 480x320-Pixel Resolution/ 480p And 576p Component TV Out/ Mac And Windows Compatible/ Black Finish",$229.00,Sony MDREX81LP Comfort Fit Ear Hanger Headphones- Choose Color (Black),_,_
53535,1046,418,Flip Video F460 Black Mino HD Camcorder - F460B,"Flip Video F460 Black Mino HD Camcorder - F460B/ 60 Minutes Recording Time/ 4GB Internal Memory/ 1.5' Transflective TFT LCD Screen/ Internal Lithium-Ion Rechargeable Battery/ Smooth Multi-Step 2x Digital Zoom/ Touch-Sensitive Capacitive Buttons/ Built-In Flip-Out USB Arm/ Built-In Speaker/ Built-In, Wide-Range, Omni-Directional Microphone",_,Sony MDREX81LP Comfort Fit Ear Hanger Headphones- Choose Color (Black),_,_
53629,585,420,Panasonic Black 8.5' Portable DVD Player - DVDLS83,Panasonic Black 8.5' Portable DVD Player - DVDLS83/ 8.5' Free Style Wide Screen LCD Display/ 6 Hour Battery/ Multi Format Playback/ Dual Headphone Jacks/ DivX Playback/ Car DC Adapter Included/ Black Finish,_,Apple iPod Shuffle 1GB MP3 Player - MB226LL/A,1GB Flash Memory - Silver,_
54085,642,423,Samsung 5 Disc Home Theater Surround Sound System - HTZ510,Samsung 5 Disc Home Theater Surround Sound System - HTZ510/ 5-Disc DVD Changer/ HDMI Output/ 5.1 Channel Home Theater Audio System/ Multimedia Disc Playback/ XM Satellite Radio-Ready/ Wireless Ready/ iPod Connectivity Compatible/ Black Finish,_,Klipsch RoomGroove Wireless iPod Speaker System - 1006602,Black,$199.99
54148,1006,423,Apple 8GB Black 2nd Generation iPod Touch - MB528LLA,"Apple 8GB Black 2nd Generation iPod Touch - MB528LLA/ Holds Up To 1,750 Songs In 128-Kbps AAC Format, 10,000 iPod-Viewable Photos And 10 Hours Of Video/ Wi-Fi (802.11b/g)/ Nike + iPod Support Built-In/ Maps Location-Based Service/ 3.5' (Diagonal) Widescreen Multi-Touch Display/ 480x320-Pixel Resolution/ 480p And 576p Component TV Out/ Mac And Windows Compatible/ Black Finish",$229.00,Klipsch RoomGroove Wireless iPod Speaker System - 1006602,Black,$199.99
54927,82,431,Kingdom Hearts II Video Game For The Sony PS2 - 662248904115,"Kingdom Hearts II Video Game For The Sony PS2 - 662248904115/ Guide Sora And Friends In All-New locales Based On Disney Films/ Fight Alongside Classic Final Fantasy Characters As Well As Modern Disney Heroes/ Perform New Character-Specific Double Team Attacks While Battling Enemies/ Visit Beasts Castle, Port Royale, Pride Land, Agrabah, Halloween Town, And More/ Rated E For Everyone 10 And Older",_,Canon PSC-85 Deluxe Soft Case for the Powershot-A650 IS and A720 IS - 2595B002(AA),_,$8.77
55444,1072,432,Canon 2GB SD Secure Digital Card - 3505B001,Canon 2GB SD Secure Digital Card - 3505B001/ Compatible With All Digital Cameras and Devices That Accept SD Cards,_,Sony InfoLITHIUM D-Type NP-FD1 Digital Camera Battery - NPFD1,Lithium Ion (Li-Ion) - 4.2V DC - Photo Battery,$41.72
56312,560,436,OmniMount 37' - 63' Ultra Low Profile Series Large Flat Panel TV Black Mount - ULPTLBK,OmniMount 37' - 63' Ultra Low Profile Series Large Flat Panel TV Black Mount - ULPTLBK/ Ultra Low Profile Design/ Built-In Kickstand/ Universal Rails/ Tension Adjustment/ Sliding Lateral On-Wall Adjustment/ Lift N? Lock For Easy Installation/ Anti-Theft Security Feature/ Black Finish,_,Peerless SS550P Flat Panel TV Stand,Glass - Black,_
56516,712,437,Sony 5.1 Channel Black A/V Receiver - STRDG520,"Sony 5.1 Channel Black A/V Receiver - STRDG520/ 100 Watts X 5 Power/ 1080p HDMI Pass Through/ Accepts 1080/60p And 24p Video Signal Via HDMI/ Dolby Digital, Dolby Pro Logic, Dolby Pro Logic II, Digital Cinema Sound And Dts Decoding/ Black Finish",$199.00,Sony LFV30 Network Media Player,"Ethernet, Wi-Fi",$172.47
56960,790,442,LG 2.0 Cu. Ft. Over-The-Range White Microwave Oven - LMVM2085WH,LG 2.0 Cu. Ft. Over-The-Range White Microwave Oven - LMVM2085WH/ Warming Lamp/ Glide & Spin Sliding Tray With Turntable/ Sensor Cook Feature/ 300 CFM Exhaust System/ Horizontal Keypad/ Elegant Hidden Vent/ WideView Window/ Halogen Cooktop Lighting/ White Finish,_,LG 27' Front-Load Electric Dryer with 7.3 cu. ft. Capacity,_,_
57428,572,448,Sony High Definition HDV Handycam Camcorder - HDRHC9,Sony High Definition HDV Handycam Camcorder - HDRHC9/ 10X Optical/20X Digital Zoom/ 2.7' Wide (16:9) Touch Panel Clear Photo LCD Plus Display/ Switchable HDV/DV Format Recording/ Active Interface Shoe/ Built-In Intelligent Flash/ Progressive Shutter System/ Super NightShot Infrared System/ x.v. Color Technology,_,Sony LCS-CSL Cyber-shot Camera Case,Top Loading - Leather - Black,_
57620,209,449,Cuisinart Cordless Electric Kettle - KUA17,Cuisinart Cordless Electric Kettle - KUA17/ 1-3/4 Quart Capacity/ Automatic Shut-Off/ Indicator Light/ Splash Guard Spout/ Cord Storage In Base/ Chrome Finish,$70.00,Panasonic KX-TGA820B Cordless Handset,Black,$39.76
57690,674,449,Logitech White V470 Cordless Laser Mouse For Apple Notebooks - 910000692,Logitech White V470 Cordless Laser Mouse For Apple Notebooks - 910000692/ Laser Precision/ Side-To-Side Scrolling Plus Zoom/ Bluetooth Wireless Technology/ Protective Pouch/ Battery Life Indicator/ White Finish,$49.00,Panasonic KX-TGA820B Cordless Handset,Black,$39.76
58021,184,453,LG Washer Dryer White Stacking Kit - WSTK1,LG Washer Dryer White Stacking Kit - WSTK1/ Stack Dryer On Top Of The Washer/ Free Up Much-Needed Space In The Laundry Room/ White Finish,_,Sirius Sportster 5 Radio with Vehicle Kit,SIRIUS SP5TK1 Sportster 5 Dock & Play Radio with Car Kit,$131.99
58464,463,457,Polk Audio CSI A4 Cherry Center Channel Loudspeaker - CSIA4CH,Polk Audio CSI A4 Cherry Center Channel Loudspeaker - CSIA4CH/ 1' Silk/Polymer Dome Tweeter/ Dual 5-1/4' Mid/Woofers/ Magnetic Shielding/ All-MDF Construction/ Acoustically Inert Stamped Driver Baskets/ Floating Anti-Diffraction Grilles/ Dual Bi-Ampable Gold-Plated 5-Way Binding Post Inputs/ Cherry Finish/ Sold As A Single,$279.95,SIRIUS SRH1000 Polk Audio Designs? Dual Zone Home Tuner,_,_
59686,610,464,Panasonic Blue 8.1 Megapixel Digital Camera - DMCFS3A,Panasonic Blue 8.1 Megapixel Digital Camera - DMCFS3A/ 8.1 Megapixel/ 33mm Lens/ 3x Optical Zoom/ Intelligent Auto Mode/ 2.5' Diagonal Intelligent LCD/ MEGA Optical Image Stabilization/ Intelligent ISO Control/ Face Detection/ Hi-Speed Burst Mode/ Blue Finish,_,Nikon D300 Digital SLR Camera - 25432,12.3 Megapixel - 3' Active Matrix TFT Color LCD,"$1,521.09"
59702,635,464,Olympus Evolt-420 10 Megapixel Digital SLR Camera With 14-42mm Lens In Black - EVOLTE420KIT,Olympus Evolt-420 10 Megapixel Digital SLR Camera With 14-42mm Lens In Black - EVOLTE420KIT/ On-Screen Autofocus/ Face Detection/ Shadow Adjustment/ Digital Image Stabilization/ Dust Reduction System/ 10-Megapixel/ 2.7' HyperCrystal II LCD/ In-Camera Panorama Mode/ Perfect Shot Preview/ Includes ED 14-42mm f3.5/5.6 Zuiko Digital Zoom Lens/ Black Finish,_,Nikon D300 Digital SLR Camera - 25432,12.3 Megapixel - 3' Active Matrix TFT Color LCD,"$1,521.09"
60018,670,465,Logitech Black V450 Nano Cordless Laser Mouse For Notebooks - 910000619,Logitech Black V450 Nano Cordless Laser Mouse For Notebooks - 910000619/ Laser Precision/ Side-To-Side Scrolling Plus Zoom/ Advanced 2.4 GHz Wireless Connection/ Storable Nano Reciever/ 12 Months Battery Life With Indicator Light/ Black Finish,$49.00,Yamaha YSP-4000 Digital Sound Projector -- Black - YSP-4000BL,_,_
60030,685,465,Samsung 19' Black Flat Panel Series 6 LCD HDTV - LN19A650,"Samsung 19' Black Flat Panel Series 6 LCD HDTV - LN19A650/ 1440 x 900 True 720p Resolution/ 3,000:1 Dynamic Contrast Ratio/ SRS TruSurround XT/ Built-In Digital Tuner (ATSC/Clear QAM)/ Wide Color Enhancer/ 8ms Response Time/ Touch Of Color Design/ Black With Red Finish",$499.00,Yamaha YSP-4000 Digital Sound Projector -- Black - YSP-4000BL,_,_
61579,132,489,Lowepro Digital Camera Case In Black - EDIT100BK,"Lowepro Edit 100 Digital Camera Case In Black - EDIT100BK/ Designed For Digital Cameras/ Includes Lots Of Accessory Pockets/ Soft, Lining, Padded Interior/ Adjustable Divider/ Water-Resistant Nylon And Microfiber",_,Nintendo DS Lite (Cobalt Blue and Black) - USGSBMKB,_,_
61728,556,489,Polk Audio Black 10' Powered Subwoofer - PSW110BK,Polk Audio PSW110 Black 10' Powered Subwoofer - PSW110BK/ 100 Watts Continuous Average Output/ 200 Watts Dynamic Power Output/ 10' Dynamic Balance Composite Woofer Driver/ Klippel Optimized Woofer/ High Current Class A/B Amplifiers/ Downward Firing Port/ Line And Speaker Level Inputs/ Non-Resonant MDF Construction/ Black Finish,$299.95,Nintendo DS Lite (Cobalt Blue and Black) - USGSBMKB,_,_
61993,1061,489,Samsung Stereo Bluetooth Headset In Black - SBH500,Samsung Stereo Bluetooth Headset - SBH500/ Integrated Microphone/ Receive Inbound Calls/ Enjoy Full Fidelity And Premium Audio Sound/ 12 Hours Talk Time/ 11 Hours Play Time/ 205 Hours Of Standby Time/ Send & End Function/ 3-way Calling/ Wireless Stereo Music Streaming/ Black Finish,_,Nintendo DS Lite (Cobalt Blue and Black) - USGSBMKB,_,_
62250,568,494,Sony 30GB Handycam Hard Disk Drive Camcorder - DCRSR45,Sony 30GB Handycam Hard Disk Drive Camcorder - DCRSR45/ 1/8' Advanced HAD CCD Imager/ 40X Optical/2000X Digital Zoom/ 2.7' Wide (16:9) Touch Panel Clear Photo LCD Plus Display/ Hybrid Recording To Hard Disk Drive Or Memory Stick Media/ Built-In Zoom Microphone With 5.1ch Recording/ Carl Zeiss Vario-Tessar Lens/ USB 2.0 Interface/ Super NightShot Infrared System,_,Canon VIXIA HV30 High Definition Digital Camcorder - 2680B001,_,$650.99
62661,505,496,Uniden DECT 6.0 Digital Accessory Handset  - DCX300,Uniden DECT 6.0 Digital Accessory Handset - DCX300/ DECT 6.0 Interference Free Cordless Frequency/ Large Color Display/ Blue Backlit Keypad/ Handset Speakerphone/ Intercom or Call Transfer Between Handsets/ Polyphonic Ring Tones/ Advanced Phonebook Features/ Last 5 Number Redial/ Piano Black Finish,$34.00,Canon DC320 Digital Camcorder - 2691B001,Canon DC320 DVD Digital Camcorder,$299.99
63299,466,499,Nikon D300 Digital SLR Digital Camera - D300BODY,"Nikon D300 Digital SLR Digital Camera - D300BODY/ 12.3 Megapixel DX-Format CMOS Sensor/ 3' Super Density 920,000-dot VGA Color Monitor/ Continuous Shooting Up To 6 Frames Per Second/ Fast Accurate 51-Point Autofocus With 3D Focus Tracking/ Scene Recognition System (SRS)/ Dynamic Integrated Dust Reduction System/ Two LiveView Shooting Modes/ Picture Control Settings/ Rugged Magnesium-Alloy Construction/ Black Finish/ Body Only",_,Canon FS11 Digital Camcorder - 2685B001,Canon FS11 Flash Memory Camcorder,$405.97
63864,152,503,Bose Acoustimass 5 Series III Speaker System - AM53BK,Bose Acoustimass 5 Series III Speaker System - AM53BK/ 2 Dual Cube Speakers With Two 2-1/2' Wide-range Drivers In Each Speaker/ Powerful Bass Module With Two 5-1/2' Woofers/ 200 Watts Max Power/ Black Finish,$399.00,Uniden DCX300 DECT 6.0 Accessory Handset and Cradle for the DECT2000 series,_,_
64012,843,503,Speck Black ToughSkin Case For iPhone 3G - IPH3GBLKTS,"Speck Black ToughSkin Case For iPhone 3G - IPH3GBLKTS/ Tough, Textured And Ruggedized Protection/ Bottom Hinges Open To Allow Docking/ Thicker Corners For Extra Protection/ Removable Rotating Belt Clip/ Lightweight Design/ Easy Access To All Ports & Controls/ Black Finish (iPhone Not Included)",$34.00,Uniden DCX300 DECT 6.0 Accessory Handset and Cradle for the DECT2000 series,_,_
64241,873,504,Panasonic Expandable Bluetooth-Enabled DECT 6.0 Phone System - KXTH1212B,Panasonic Expandable Bluetooth-Enabled DECT 6.0 Phone System - KXTH1212B/ Call Waiting Caller ID/ White Backlit Color LCD/ Lighted Handset Keypad/ Night Mode/ Compatible With Most Bluetooth Cell Phones/ 5 Hours Talk Time/11 Days Standby Time/ 60 Channels/ Black Finish,_,Panasonic KX-TG4323B 5.8 GHz Expandable Digital Cordless Phone,1 x Phone Line(s) - Black,_
64422,631,505,Panasonic DECT 6.0 Black Metallic Expandable Digital Cordless Phone System - KXTG9332T,Panasonic DECT 6.0 Black Metallic Expandable Digital Cordless Phone System - KXTG9332T/ 2 Handsets/ Up To 6 Multi-Handset Capability/ Digital Answering Machine System/ Ringer ID/ Call Waiting Caller ID/ Voicemail/ Hold/ Mute/ Clock/ Alarm/ LED Lighting/ Night Mode/ Call Block/ Speakerphone/ 11 Days Standby/ 5 Hours Talk Time/ Black Metallic Finish,_,Panasonic KX-TG4324B 5.8 GHz Expandable Digital Cordless Phone,1 x Phone Line(s) - Black,$78.33
64438,707,505,Panasonic Black DVD Home Theater Sound System - SCPT660,Panasonic Black DVD Home Theater Sound System - SCPT660/ Kelton Subwoofer/ Bamboo Diaphragm Center Speakers/ 1080p Up-Conversion/ Integrated Universal Dock And On-Screen Display For iPod/ iPod Video Playback/ Whisper-Mode Surround/ Built-In Dolby Digital And DTS Decoder/ High Speed 5-DVD/CD Changer/ Black Finish,$289.00,Panasonic KX-TG4324B 5.8 GHz Expandable Digital Cordless Phone,1 x Phone Line(s) - Black,$78.33
