_id,ltable_id,rtable_id,ltable_name,ltable_description,ltable_price,rtable_name,rtable_description,rtable_price
98521,408,687,Denon 7.1 Channel Home Theater MultiMedia A/V Receiver With Networking In Black - AVR3808CI,Denon 7.1 Channel Home Theater MultiMedia AV Receiver With Networking In Black - AVR3808CI/ 130 Watts x 7 Channels/ Fully Assignable Channels For Bi-Amping/ Rear Panel RS-232C And Ethernet Ports/ Network Capable/ XM Ready Tuning/ Dolby TrueHD And DTS-HD Master Audio/ Expanded HDMI v1.3a Ports/ Dual Remotes/ Black Finish,"$1,699.99",Samsung HT-TZ515 Home Theater System - HTZ515/XAA,SAMSUNG 5 DVD HM THEATER WI-FI XM READY NIC,_
98534,558,687,Bose Lifestyle 48 Series IV 43479 Home Entertainment System - LS48IVWH,Bose Lifestyle 48 Series IV Home Entertainment System - LS48IVWH/ ADAPTiQ Audio Calibration System/ Acoustimass Module/ Jewel Cube Speakers/ Direct/Reflecting Speaker Technology/ VS-2 Video Enhancer/ Proprietary Videostage 5 Decoding Circuitry/ Digital 5.1 Decoding/ Control Integration/ White Finish,"$3,999.00",Samsung HT-TZ515 Home Theater System - HTZ515/XAA,SAMSUNG 5 DVD HM THEATER WI-FI XM READY NIC,_
99131,1052,691,Onkyo THX Ultra2 Certified 7.1 Channel Home Theater Black Receiver - TXNR906B,"Onkyo THX Ultra2 Certified 7.1 Channel Home Theater Black Receiver - TXNR906B/ 145W x 7/ HDMI v1.3/ All Discrete Circuitry/ Absolute Ground Plate/ Optimum Gain Volume/ Audyssey Dynamic EQ/ Non-Scaling Configuration/ Toroidal Transformer/ Dolby Digital Plus, Dolbyl TrueHD, DTS-HD Master Audio, DTS-HD High Resolution Audio Decoder/ Music Optimizer/ HDMI Deep Color Capable (36bit)/ 1080p Upscaling Via HDMI/ Analog To HDMI Upconversion/ Permanent Memory Storage/ Back-Lit Remote/ Black Finish",_,Ex Series Earbuds Black - MDR EX32LP/BLK,_,$15.65
99421,1032,695,Sharp AQUOS 52' D85U Series Black LCD Flat Panel HDTV - LC52D85U,"Sharp AQUOS 52' D85U Series Black LCD Flat Panel HDTV - LC52D85U/ Full HD 1080p (1920 x 1080) Resolution/ 10-Bit Advanced Super View/ 120Hz Fine Motion Enhanced/ Built-In ATSC/QAM/NTSC Tuners/ 60,000 Hours Lamp Life/ 10,000:1 Dynamic Contrast Ratio/ 4ms Response Time/ 3-Wavelength Back-Light System/ Black Finish",_,Ex Series Earbuds Wht - MDR EX32LP/WHI,_,$16.99
99696,752,696,Sony Black Bravia Home Theater System - DAVHDX279W,Sony Black Bravia Home Theater System - DAVHDX279W/ iPod Cradle/ Digital MEDIA Port And S-AIR Surround Wireless Included/ BRAVIA Sync/ 1080p Upscaling Via HDMI/ 5-Disc DVD/CD Player/ Digital Cinema Auto Calibration/ Black Finish,_,Ex Series Earbuds Black - MDR EX55/BLK,_,$22.20
100328,459,699,Polk Audio Sirius Satellite Radio Home Tuner - SRH1000,"Polk Audio Sirius Satellite Radio Home Tuner - SRH1000/ 6-Line, Front Panel Graphic Display/ SIRIUS Replay/ TV Screen Graphical User Interface/ RCA Stereo & Optical Digital Outputs / Black Finish",_,Yamaha RX-V363 Home Theater Receiver - RXV363BL,"500W - Dolby Digital, Dolby Pro Logic II, DTS",$199.00
100512,57,702,Sanus Silver LCD Television Turntable - TVLCDS,Sanus Silver LCD Television Turntable - TVLCDS/ Holds 13'-30' Size Televisions/ 360 Degree Rotation/ Silver Finish,$29.99,Samsung 7 Series LN46A750 46' LCD TV - LN46A750R1FXZA,"Samsung LN46A750 - 46' 1080p LCD HDTV - 50,000:1 Dynamic Contrast Ratio - 6ms Response Time - 120Hz","$1,537.77"
100675,978,702,Sony VAIO CS Series Red Notebook Computer - VGNCS110ER,Sony VAIO CS Series Red Notebook Computer - VGNCS110ER/ 2.0GHz Intel Core 2 Duo Processor T5800/ 14.1' (1280 x 800) XBRITE-ECO Widescreen Display/ 250GB Serial ATA 5400rpm Hard Drive/ Built-In 1.3 Megapixel MOTION EYE Camera And Microphone/ 3GB PC2-6400 (2GBx1 + 1GBx1) Installed Memory/ Integrated Stereo A2DP Bluetooth/ 800MHz Front Side Bus Speed/ 2MB L2 Cache/ Genuine Microsoft Windows Vista Home Premium 32-bit With SP1/ Red Finish,_,Samsung 7 Series LN46A750 46' LCD TV - LN46A750R1FXZA,"Samsung LN46A750 - 46' 1080p LCD HDTV - 50,000:1 Dynamic Contrast Ratio - 6ms Response Time - 120Hz","$1,537.77"
100951,341,705,Panasonic Countertop Microwave Oven In Stainless Steel - NNSD667SS,Panasonic NN-SD667S Countertop Microwave Oven In Stainless Steel - NNSD667SS/ 1.2 Cubic Foot/ 1250 Watts High Power/ 10 Power Levels/ 5 Cooking Stages/ Quick Minute/ Easy-To-Use Pop-Out Dial/ One-Touch Sensor Cooking/ Inverter Turbo Defrost/ Multi-Lingual Menu Action Screen/ Popcorn Key/ Stainless Steel Finish,_,Panasonic SC-PT760 Home Theater System,Panasonic SC-PT760 Premium Sound DVD Home Theater System with Kelton Subwoofer,$319.97
100993,588,705,Panasonic Black 1080p Up-Conversion DVD Recorder - DMREZ28K,Panasonic Black 1080p Up-Conversion DVD Recorder - DMREZ28K/ Digital Tuner And 1080p Up-Conversion/ Simple Recording And Playback With VIERA Link/ Digital Camera Connection With SD Memory Card And USB Cable/ Super Multi Format Recording And Playback/ DivX Playback/ Auto Drive Select/ Black Finish,_,Panasonic SC-PT760 Home Theater System,Panasonic SC-PT760 Premium Sound DVD Home Theater System with Kelton Subwoofer,$319.97
101012,625,705,Panasonic DECT 6.0 Expandable Digital Cordless Phone With All-Digital Answering System - KXTG9344T,Panasonic DECT 6.0 Expandable Digital Cordless Phone With All-Digital Answering System - KXTG9344T/ 4 Handsets System/ Up To 6 Multi-Handset Capability/ Digital Answering Machine System/ Ringer ID/ Call Waiting Caller ID/ Voicemail/ Hold/ Voice Menu/ Marker Message/ Mute/ Clock/ Alarm/ LED Lighting/ Night Mode/ Call Block/ Speakerphone/ 11 Days Standby/ 5 Hours Talk Time/ Black Metallic Finish,$139.00,Panasonic SC-PT760 Home Theater System,Panasonic SC-PT760 Premium Sound DVD Home Theater System with Kelton Subwoofer,$319.97
101692,693,709,Sony Bud Style Headphones In Silver - MDRED12LPSLV,"Sony Bud Style Headphones In Silver - MDRED12LPSLV/ 16mm Drivers/ Crisp Sound/ Neodymium Magnets Offer Powerful Sound Reproduction/ Convenient Cord Slider Reduces Tangles/ 3.9 Ft. Cord Length/ Frequency Response Of 8-22,000Hz/ Silver Finish",$14.00,Sony STR-DG520 A/V Receiver - STRDG520,"Dolby Digital, Dolby Pro Logic II, Digital Cinema Sound, DTS",$164.51
102046,263,711,Sony MS-A1GD 1GB Memory Stick Micro (M2) - MSA1GD,Sony MS-A1GD 1GB Memory Stick Micro (M2) - MSA1GD/ 1GB Storage Capacity With 900MB Available/ Minimum Write Speeds Of 15 Mbps On Memory Stick Micro Enabled Devices,_,Sony DVP-NS700H/B DVD Player,"DVD-RW, DVD+RW, DVD-R, DVD+R, CD-RW - DVD Video, CD-DA, MP3, JPEG, SVCD, Video CD Playback - 1 Disc(s) - Progressive Scan - Black",_
103380,722,720,Samsung 52' Series 7 Black Flat Panel LCD HDTV - LN52A750,"Samsung 52' Series 7 Black Flat Panel LCD HDTV - LN52A750/ 1920 x 1080 Full HD Resolution/ 50,000:1 Dynamic Contrast Ratio/ 4ms Response Time/ SRS Trusurround XT/ Touch Of Color Design/ Auto Motion Plus 120Hz/ Ultra Clear Panel/ Pre-Loaded Content/ Black Finish",_,Sony Cyber-shot DSC-H50 Digital Camera - Black - DSCH50B,9.1 Megapixel - 16:9 - 2x Digital Zoom - 3' Active Matrix TFT Color LCD,$329.00
103771,951,721,Canon PowerShot Black Digital Camera - SX110ISB,Canon PowerShot SX110 IS Black Digital Camera - SX110ISB/ 9.0 Megapixel/ 10x Optical Zoom Lens With Optical Image Stabilizer Technology/ 3.0' LCD Display/ DIGIC III Image Processor/ Face Detection/ Motion Detection/ 20 Shooting Modes Including 8 Special Scene Modes/ Red-Eye Correction/ Automatic ISO Settings/ Print-Share Button/ Power By AA Batteries For Convenient/ Black Finish,_,Samsung SC-D382 Digital Camcorder,Samsung SC-D382 Mini DV Camcorder,$128.96
103853,595,722,Yamaha NS-AW190BL All-Weather Pair Speaker System - NSAW190BK,Yamaha NS-AW190BL All-Weather Speaker System - NSAW190BK/ 5' High Compliance/ PP Mica Filled Woofers/ Unique Dual 1/2' PEI Dome Tweeter Configuration/ Aluminum Speaker Grilles/ Wall Mountable/ Black Finish/ Sold As A Pair,$99.00,Samsung HTX810T Home Theater System - HTX810T,Samsung HT-X810 2.1 Soundbar Home Theater System,$580.14
103983,66,723,Canon Rechargeable Battery - 9763A001,"Canon Rechargeable Battery - 9763A001/ Compatible With The SD200, SD300, SD400, SD30, SD450, SD600, SD630, SD750, SD1000 And Other PowerShot Cameras/ OEM Litium Ion Battery /  180 Minutes Of Playback Time",_,Kensington Mini Battery Pack and Charger for iPhone and iPod - K33442US,_,_
104096,806,723,Speck SeeThru Pink Hard Shell Case For 15' MacBook - MB15PNKSEEV2,Speck SeeThru Pink Hard Shell Case For 15' MacBook - MB15PNKSEEV2/ Translucent Hard Plastic Shell Gives Great Protection/ Full Access To All Controls/ Rubber Feet For Added Support/ Pink Finish,_,Kensington Mini Battery Pack and Charger for iPhone and iPod - K33442US,_,_
104431,641,724,Samsung 52' Series 6 LCD Black Flat Panel HDTV - LN52A650,"Samsung 52' Series 6 LCD Black Flat Panel HDTV - LN52A650/ Full 1080p High Definition Resolution/ 16:9 Widescreen Aspect Ratio/ 50,000:1 Dynamic Contrast Ratio/ 4ms Response Time And Auto Motion Plus 120Hz Technology/ SRS TruSurround XT Audio/ Built-In Digital Tuner (ATSC/Clear QAM)/ Picture-In-Picture/ Auto Volume Leveler/ 4 HDMI Slots/ Swivel Stand/ Piano Black With Hint Amber Finish",_,Samsung DVD-V9800 DVD/VCR Combo Player w/ 1080p Up-Conversion,_,$85.06
104882,676,729,Yamaha 7.2 Channel Black Digital Home Theater Receiver - RXV863BK,Yamaha 7.2 Channel Black Digital Home Theater Receiver - RXV863BK/ 4 SCENE Buttons/ XM Ready With XM HD Surround/ SIRIUS Satellite Radio Ready/ YPAO/ iPod Compatibility/ Bluetooth Compatibility/ Multi-Zone Control Compatibility/ On-Screen Display/ Black Finish/ CALL FOR LATEST PRICE,$899.00,Yamaha YHT-390BL Home Theater System - YHT-390bl,", 5.1 Speakers - Progressive Scan - 600W RMS - Black",$319.96
104895,736,729,Nintendo DS Lite Metallic Rose Portable Gaming System - NDSUSGSZPB,Nintendo DS Lite Metallic Rose Portable Gaming System - NDSUSGSZPB/ Dual 3' TFT Color LCD Touchscreens/ Slimmer Design/ Dual Slot Compatibility (DS Lite/Game Boy Advance Game Paks)/ Twin Ultra Bright LCD Screens/ Up To 19 Hours Continuous Gameplay/ Nintendo Wi-Fi Connection/ Impressive 3D Graphics/ Dual Stereo Speakers/ Metallic Rose Finish,$139.00,Yamaha YHT-390BL Home Theater System - YHT-390bl,", 5.1 Speakers - Progressive Scan - 600W RMS - Black",$319.96
106009,588,740,Panasonic Black 1080p Up-Conversion DVD Recorder - DMREZ28K,Panasonic Black 1080p Up-Conversion DVD Recorder - DMREZ28K/ Digital Tuner And 1080p Up-Conversion/ Simple Recording And Playback With VIERA Link/ Digital Camera Connection With SD Memory Card And USB Cable/ Super Multi Format Recording And Playback/ DivX Playback/ Auto Drive Select/ Black Finish,_,Sony DVP-NC800H/B DVD Player,"DVD+RW, DVD-RW, DVD+R, DVD-R, CD-RW - DVD Video, CD-DA, MP3, JPEG, SVCD, Video CD Playback - 5 Disc(s) - Progressive Scan - Black",_
106145,745,741,Alpine V-Power Series 4/3/2 Channel Power Amplifier - MRPF300,"Alpine V-Power Series 4/3/2 Channel Power Amplifier - MRPF300/ 50W x 4 RMS Power Output/ Continuously Adjustable Gain Control/ Dual Sided Glass Epoxy PC Board/ Non-Fading Pre-Amp Output/ Gold Plated Input, Output, Power And Speaker Terminals/ Adjustable Low-Pass/High-Pass Crossover/ MOSFET Power/ Thermal Management Control",_,ALPINE MRP-F300 Car Amplifier,4 Channel(s) - Class AB - 100dB SNR,_
106180,462,742,Polk Audio CSI A4 Black Center Channel Loudspeaker - CSIA4BK,Polk Audio CSI A4 Black Center Channel Loudspeaker - CSIA4BK/ 1' Silk/Polymer Dome Tweeter/ Dual 5-1/4' Mid/Woofers/ Magnetic Shielding/ All-MDF Construction/ Acoustically Inert Stamped Driver Baskets/ Floating Anti-Diffraction Grilles/ Dual Bi-Ampable Gold-Plated 5-Way Binding Post Inputs/ Black Finish/ Sold As A Single,$279.95,Pioneer DEHP500UB Car Audio Player,"CD-RW - CD-Text, MP3, WMA, WAV, AAC - 4 - 200W - FM, AM",$153.64
106358,61,744,Sanus 13' - 30' Flat Panel TV Black Wall Mount - VM1B,Sanus 13' - 30' Flat Panel TV Black Wall Mount - VM1B/ Tilt And Swivel Motion/ Rigid Extruded Aluminum Construction/ Supports Up To 50 Lbs/ Black Finish,$69.99,CORDED TELEPHONE - KEYPAD - SINGLE-LINE OPERATION - 2-WAY - LCD DISPLAY - BLACK - KX-TS620B,_,_
106975,171,746,Panasonic Digital Camera Battery - CGAS007A1B,Panasonic Digital Camera Battery - CGAS007A1B/ Lithium Ion Type/ For Digital Camera DMCTZ1 And DMCTZ3,_,Panasonic SC-PT960 Home Theater System,"Panasonic SC-PT960 5-Disc DVD Home Theater System with Kelton Subwoofer, 1080p Up-Conversion, Integrated Universal Dock for iPod, 2 Tower Speakers, Wireless Rear Speaker and VIERA Link",$349.99
107643,852,748,Sony HD Radio Add On Tuner - XT100HD,Sony HD Radio Add On Tuner - XT100HD/ High-Fidelity FM/AM Digital Radio With HD Radio Technology/ Compatible With Most 2005 Headunits And Later That Are SAT Radio Ready/ Built-In Sony Bus Connectivity/ Black Finish,_,Sony BRAVIA DAV-HDX279WC Home Theater System,"DVD Player, 6.1 Speakers - 5 Disc(s) - Progressive Scan - Dolby Digital, DTS, Dolby Pro Logic II - Black",$318.01
107730,50,749,Sony DVD-R Recordable Camcorder Media - 3DMR30L1H,"Sony DVD-R Recordable Camcorder Media 3 Pack - 3DMR30L1H/ 30 Minute, 1.4 GB/ Accucore Technology/ Store Digital Video, Audio And Multimedia Files/ 3 Pack",$9.99,Sony DVP-FX820/L Portable DVD Player - DVPFX820/L,"8' LCD - DVD+R, DVD+RW, DVD-RW, DVD-R, CD-RW - JPEG, MP3, DVD Video Playback - 1 Disc(s) - Blue",$131.54
107923,913,749,Toshiba 22' LCD HDTV With Built In DVD Player In White - 22LV506,Toshiba 22' LCD HDTV With Built In DVD Player In White - 22LV506/ Built-In Slot Loading DVD Player/ Built-In ATSC/NTSC/QAM Digital Tuning/ Official DivX Certified/ PC Input/ Space Saving Design/ Bottom Mount Stereo Speakers/ Glossy White Finish,_,Sony DVP-FX820/L Portable DVD Player - DVPFX820/L,"8' LCD - DVD+R, DVD+RW, DVD-RW, DVD-R, CD-RW - JPEG, MP3, DVD Video Playback - 1 Disc(s) - Blue",$131.54
108980,446,759,LG DLEX8377NM Navy Blue XL Capacity Electric SteamDryer - DLEX8377BLUE,LG DLEX8377NM Navy Blue XL Capacity Electric SteamDryer - DLEX8377BLUE/ 7.3 Cu. Ft. Capacity/ Intelligent Electronic Controls With Dual LED Display And Dial-A-Cycle/ Dual Humidity Sensors/ Precise Temperature Control With A Variable Heater/ 4 Way Venting/ Drum Light/ Navy Blue Finish,_,LG 24.7 cu. ft. Stainless Steel French Door Bottom Mount Refrigerator,_,_
109447,579,763,Sony DSLR-A350 Digital Camera And 18-70mm Zoom Lens - DSLRA350K,Sony DSLR-A350 Digital Camera And 18-70mm Zoom Lens - DSLRA350K/ 14.2 Megapixel/ Tiltable 2.7 Clear Photo LCD Plus Screen/ Smart Teleconverter 2X Zoom/ Bionz Image Processor/ Super SteadyShot In-Camera Image Stabilization/ Anti-Dust Technology/ Eye-Start Autofocus System/ Auto Pop-Up Flash/ Black Finish,_,"LG LDF6920ST Fully Integrated Dishwasher with 5 Wash Cycles, 3 Spray Arms, SenseClean System, Delay Start, Food Disposer and Self-Clean Filter: Stainless Steel",_,_
109648,790,764,LG 2.0 Cu. Ft. Over-The-Range White Microwave Oven - LMVM2085WH,LG 2.0 Cu. Ft. Over-The-Range White Microwave Oven - LMVM2085WH/ Warming Lamp/ Glide & Spin Sliding Tray With Turntable/ Sensor Cook Feature/ 300 CFM Exhaust System/ Horizontal Keypad/ Elegant Hidden Vent/ WideView Window/ Halogen Cooktop Lighting/ White Finish,_,LG Dishwasher,_,_
109832,655,765,Samsung 37' Series 4 LCD Black Flat Panel HDTV - LN37A450,"Samsung 37' Series 4 LCD Black Flat Panel HDTV - LN37A450/ True 720p High Definition Resolution/ 16:9 Widescreen Aspect Ratio/ 10,000:1 Dynamic Contrast Ratio/ 6ms Response Time/ SRS TruSurround XT Audio/ Built-In Digital Tuner (ATSC/Clear QAM)/ 3 HDMI Slots/ Hidden Bottom Speakers/ Swivel Stand/ Black Finish",_,LG Semi-Integrated Electronic Panel with Digital Status Display,_,_
109865,758,765,LG LFC25770SB 25.0 Cu. Ft. Smooth Black French Door Bottom Freezer Refrigerator - LFC25770BK,LG LFC25770SB 25.0 Cu. Ft. Smooth Black French Door Bottom Freezer Refrigerator - LFC25770BK/ 4 Slide Out Tempered Glass Shelves/ Internal LED Touch Pad Digital Temperature Controls/ 2 Humidity Crispers/ Multi Air Flow Cooling/ IcePlus Accelerated Freezing Function/ LoDecibel Quiet Operation/ BioShield Anti Bacterial Door Seal/ Pull Out Freezer Drawer/ Smooth Black Finish,_,LG Semi-Integrated Electronic Panel with Digital Status Display,_,_
110476,213,769,LG WM3431W All-In-One White Washer And Dryer Combo - WM3431WH,LG WM3431W All-In-One Front Load White Washer And Dryer Combo - WM3431WH/ 2.44 Cu. Ft. Capacity/ NeveRust Stainless Steel Drum/ 1400 RPM Maximum Spin Speed/ Ventless Condensing Drying System/ 9 Wash Programs/ 5 Rinse Temperatures/ LoDecibel Quiet Operation/ Upfront Electronic Controls With Dial-A-Cycle/ White Finish,_,LG 5.6 cu.ft. Freestanding Electric Range,_,_
111377,540,777,Toshiba Black DVD Recorder/VCR Combinaton With Built-In Digital Tuner - DVR660,Toshiba Black DVD Recorder/VCR Combinaton With Built-In Digital Tuner - DVR660/ Built-In ATSC/NTSC/QAM Digital/Analog Tuner/ Multi-Format Recording And Playback/ Video Upconversion Up To 1080p Resolution/ One Touch Recording/ Camcorder Controls/ Auto Finalize With Undo/ Bi-Directional Dubbing/ Black Finish,_,Sony Cyber-shot DSC-W150 Digital Camera - Gold - DSCW150N,8.1 Megapixel - 16:9 - 2x Digital Zoom - 2.7' Active Matrix TFT Color LCD,$129.99
111397,596,777,Samsung Black 8.1 Megapixel Digital Camera - ECNV30ZBBA,Samsung NV30 Black 8.1 Megapixel Digital Camera - ECNV30ZBBA/ 3x Optical Zoom Lens/ 2.5' LCD Display/ High Resolution CCD Sensor/ 20MB Internal Memory/ Dual Image Stabilization/ Face Detection/ Auto Focus/ SD Memory Card Slot/ Black Finish,_,Sony Cyber-shot DSC-W150 Digital Camera - Gold - DSCW150N,8.1 Megapixel - 16:9 - 2x Digital Zoom - 2.7' Active Matrix TFT Color LCD,$129.99
111555,1072,777,Canon 2GB SD Secure Digital Card - 3505B001,Canon 2GB SD Secure Digital Card - 3505B001/ Compatible With All Digital Cameras and Devices That Accept SD Cards,_,Sony Cyber-shot DSC-W150 Digital Camera - Gold - DSCW150N,8.1 Megapixel - 16:9 - 2x Digital Zoom - 2.7' Active Matrix TFT Color LCD,$129.99
111802,925,778,Nikon Pink 10 Megapixel COOLPIX Digital Camera - COOLPIXS60PNK,Nikon Pink 10 Megapixel COOLPIX Digital Camera - COOLPIXS60PNK/ 10 Effective Megapixels/ 5x Zoom-NIKKOR Lens/ 3.5' Wide Touch Screen High-Resolution LCD/ Portrait One-Touch Zoom/ Scene Auto Selector/ Smile Timer/ Face-Priority AF/ In-Camera Red-Eye Fix/ D-Lighting/ Champagne Pink Finish,_,Sony Cyber-shot DSC-W150 Digital Camera - Red - DSCW150R,8.1 Megapixel - 16:9 - 2x Digital Zoom - 2.7' Active Matrix TFT Color LCD,$139.94
111911,299,779,Panasonic Expandable Digital Cordless DECT 6.0 Handset In Silver - KXTGA101S,Panasonic Expandable Digital Cordless DECT 6.0 Handset In Silver - KXTGA101S/ Expansion Handset And Charger Select 1000 Series Phone Systems/ Big Buttons/ Built-In Clock With Alarm/ Silver Finish,$39.00,Sony Cyber-shot DSC-W170 Digital Camera - Red - DSCW170R,10.1 Megapixel - 16:9 - 2x Digital Zoom - 2.7' Active Matrix TFT Color LCD,$169.00
112439,136,783,Panasonic KX-TG4500B Black 5.8 GHz Cordless Phone System - KXTG4500B,Panasonic KX-TG4500B Black 5.8 GHz Cordless Phone System - KXTG4500B/ Frequency-Hopping Spread Spectrum Technology/ All-Digital Voice Mail System/ Handles Up To 4 Lines/ Tollsaver/ 2-Way Recording/ Black Finish,_,Denon DHT-FS5 Surround Sound Speaker System,5.1-channel,_
112849,777,787,LG Stainless Steel Freestanding Electric Range - LRE30757SS,LG Stainless Steel Freestanding Electric Range - LRE30757SS/ 5.6 Cu. Ft. Capacity/ Dual Convection/ Self-Cleaning/ Touch Controls/ Ceramic Cooktop/ WideView Window/ Warming Drawer/ Interior Oven Light/ Stainless Steel Finish,_,LG 2.0 cu.ft. Over the Range Microwave Oven,_,_
113007,724,789,Samsung MiniDV Digital Camcorder - SCDC382,Samsung MiniDV Digital Camcorder - SCDC382/ 680K Pixel CCD/ 34X Zoom Lens/ 720 x 480 Pixel Movie Resolution/ Digital Image Stabilizer/ 23 Language Options/ 80 Minute Battery Life,_,Pure Digital Flip Mino Digital Camcorder - F360B,Flip Video Mino 60 min Black,_
113625,136,795,Panasonic KX-TG4500B Black 5.8 GHz Cordless Phone System - KXTG4500B,Panasonic KX-TG4500B Black 5.8 GHz Cordless Phone System - KXTG4500B/ Frequency-Hopping Spread Spectrum Technology/ All-Digital Voice Mail System/ Handles Up To 4 Lines/ Tollsaver/ 2-Way Recording/ Black Finish,_,Onkyo CS-325 Stereo CD Receiver Mini Audio System,_,$238.72
113870,337,797,Panasonic Stainless Steel Countertop Microwave Oven - NNSD377SS,Panasonic NNSD377S Stainless Steel Countertop Microwave Oven - NNSD377SS/ 0.8 Cu. Ft. Capacity/ 800 Watts Cooking Power/ 6 Levels Power Settings/ 5 Multi-Stage Cooking/ Quick Minute Feature/ 4 Digit Display Panel/ Popcorn Key/ Revolving Removable Turntable/ Stainless Steel Finish,_,Maytag MMV4205BAQ Over-the-Range Microwave,_,_
114075,953,800,VMware Fusion 2 For Mac - VMFM20BX2,VMware Fusion 2 For Mac - VMFM20BX2/ Run Windows Side-By-Side With Mac OS X Without Rebooting/ 3D And High Definition Video Acceleration/ USB Device Support/ Multiple Display Support/ Seamless Keyboard Mapping/ Embedded Antivirus And Antispyware Protection/ Mac OS X Leopard Integration/ Boot Camp Support/ Multiple CPU Virtual Machines,$79.00,Speck Products SeeThru Case for Apple 13' MacBook - MB13-BLK-SEE-V2,Plastic - Black,_
114145,294,801,Sanus SC1A Black VisionMount Series Ceiling Mount For Small LCD Flat Panels - SC1AB,Sanus SC1A Black VisionMount Series Ceiling Mount For Small LCD Flat Panels - SC1AB/ Fits Most 13' - 26' LCD Flat Panel Televisions/ VESA Compatible TV Bracket/ SmoothLock Technology/ Built-In Wire Management System/ 50 Lbs Capacity/ Black Finish,$99.99,Speck Products SeeThru Case for Apple 15' MacBook Pro - MB15-CLR-SEE-V2,Plastic - Clear,_
114479,784,803,Brenthaven Sling II Titanium Laptop Carrying Bag For 15' MacBook Pro - TR654ZMA,Brenthaven Sling II Titanium Laptop Carrying Bag For 15' MacBook Pro - TR654ZMA/ Lightweight And Durable Protective Case/ Rugged Ballistic Nylon/ Custom Fit Padded Computer Compartment/ External Pocket/ Side Water Bottle Pocket/ Ergonomic Strap With Tuck Away Option/ Internal Accessory Panel/ Fits MacBook Pro 15.4'/ Titanium Finish,_,Speck Products SeeThru Case for Apple 13' MacBook - MB13-CLR-SEE-V2,Plastic - Clear,_
116274,654,816,Canon Black EOS Rebel XSi Digital SLR Camera - XSIREB1855,Canon Black EOS Rebel XSi Digital SLR Camera - XSIREB1855/ 12.2 Megapixel/ DIGIC III Image Processor/ Extensive Noise Reduction Technology/ Auto Optimization/ 3.0' LCD Monitor/ Compatible With Compact SD And SDHC Memory Cards/ EOS Integrated Cleaning System/ 18-55MM Lens Included/ 2756B003/ Black Finish,_,BlueAnt Wireless Z9i Bluetooth Headset - Black - US-091010,_,$59.99
116561,347,817,Sony SLV-D380P Black DVD VHS Combo Player - SLVD380P,"Sony SLV-D380P Black DVD VHS Combo Player - SLVD380P/ Line Input Recording/ Component Output/ Progressive Output/ Multi-Brand TV Remote Control/ CD, MP3, And JPEG Playback/ 4-Head Hi-Fi Stereo/ Auto Head Cleaner/ Black Finish/ No Tuner",_,Sony HT-DDWG700 Home Theater System - HTDDWG700,"DVD Player, 5.1 Speakers - 900W RMS - DTS, Dolby Digital, Dolby Pro Logic II",$206.96
119309,829,832,Sony 46' BRAVIA S-Series Black LCD Flat Panel HDTV - KDL46S4100,"Sony 46' BRAVIA S-Series Black LCD Flat Panel HDTV - KDL46S4100/ 1920 x 1080 Full HD Resolution/ 24p True Cinema/ ATSCTM/NTSC Tuner With QAM/ 2,500:1 Contrast Ratio/ CineMotion Reverse 3:2 Pulldown Technology/ 3D Comb Filter/ MPEG Noise Reduction/ Black Finish",_,Sony Cyber-shot DSC-W300 Digital Camera,13.6 Megapixel - 16:9 - 3x Optical Zoom - 2x Digital Zoom - 2.7' Color LCD,$289.00
119543,298,835,Panasonic Expandable Digital Cordless DECT 6.0 Answering System In Silver - KXTG1034S,Panasonic Expandable Digital Cordless DECT 6.0 Answering System In Silver - KXTG1034S/ 4 Handsets/ Extended Talk Time/ Reduced Interference/ All-Digital Answering System/ Up To 17 Hours Of Talk Time/ Expandable Up To 6 Handsets/ Up To 3-Way Conference Capability/ Built-In Clock With Alarm/ Digital Speakerphone On Handset/ Silver Finish,_,Samsung HT-X710 Bluetooth 400-Watt Home Theater System With iPod Dock,_,_
119842,128,837,Canon Deluxe Soft Black Camera Case - 0716B001,Canon Deluxe Soft Black Camera Case - 0716B001/ Compatible with Canon PowerShot S2 IS/ Black Finish,_,Griffin Protective Wave Case for Smart Phone - 8227-IP2WVB,Griffin Wave iPhone 3G - Black,_
119999,122,838,Sanus Center Channel Speaker Mount - Black Finish - VMCC1B,"Sanus Center Channel Speaker Mount - VMCC1B/ Works With Sanus Models VMSA, VMAA18, VMAA26, VMDD26 And VMCM1/ Easy To Install/ Mounting Hardware Included/ Black Finish",$99.99,CHOPS HANGER - HEADPHONE - WIRED - EARBUDS - 18 - 20000 HZ - BLACK AND CHROME - HH26-SKC01,_,$17.99
120381,1017,838,Panasonic VIERA 58' 1080p Plasma HDTV In Black - TH58PZ850U,"Panasonic VIERA 58' 1080p Plasma HDTV In Black - TH58PZ850U/ 1920 x 1080 Resolution/ 1,000,000:1 Dynamic Contrast Ratio/ VIERA Cast Internet TV Capability/ VIERA Link HDAVI Control/ Surround Sound/ BBE ViVA HD3D Sound/ Built-In Closed Caption Decoder/ Built-In SD Card Memory Slot/ Built-In NTSC/ATSC/QAM Tuners/ Black Finish",_,CHOPS HANGER - HEADPHONE - WIRED - EARBUDS - 18 - 20000 HZ - BLACK AND CHROME - HH26-SKC01,_,$17.99
120403,1061,838,Samsung Stereo Bluetooth Headset In Black - SBH500,Samsung Stereo Bluetooth Headset - SBH500/ Integrated Microphone/ Receive Inbound Calls/ Enjoy Full Fidelity And Premium Audio Sound/ 12 Hours Talk Time/ 11 Hours Play Time/ 205 Hours Of Standby Time/ Send & End Function/ 3-way Calling/ Wireless Stereo Music Streaming/ Black Finish,_,CHOPS HANGER - HEADPHONE - WIRED - EARBUDS - 18 - 20000 HZ - BLACK AND CHROME - HH26-SKC01,_,$17.99
120428,76,839,Sanus Universal Projector Ceiling Mount -  Black Finish - VMPR1B,Sanus Universal Projector Ceiling Mount - VMPR1B/ Designed For DLP And LCD Projectors/ Quick Release Mechanism/ 50 Lbs Capacity/ Black Finish,$129.99,3G iPhone Black ToughSkin - IPH3G-BLK-TS,_,$10.00
